audio	sentence
/scratch/skscla001/speech/data/nyagen/audio/221030-154054_nya_394_elicit_41.wav	mayi wina wovala malaya ofiira chipewa ndi mpango amakhala m mphepete mwa msewu atazunguliridwa ndi matumba a zinthu zosiyanasiyana ena m matumba ndipo ena ali m machubu apulasitiki abuluu ofiira kapena akuda 
/scratch/skscla001/speech/data/nyagen/audio/221109-231342_nya_626_elicit_17.wav	azimayi awiri akuyang ana tebulo lomwe lili ndi zinthu zosiyanasiyana pamisika yomwe ena akuyang ana 
/scratch/skscla001/speech/data/nyagen/audio/221110-233958_nya_626_elicit_46.wav	atsikana awiri m modzi wovala zakuda ndi m modzi wovala zoyera akulankhula pamafoni kutsogolo khoma lomwe lili ndi zikwangwani zanyimbo 
/scratch/skscla001/speech/data/nyagen/audio/221110-210505_nya_626_elicit_41.wav	mzungu wovala malaya abulauni mwamuna wakuda wovala malaya akuda ndi mkazi wa ku asia wovala malaya akuda akuyenda mumsewu kutsogolo kwa khoma la buluu lomwe likudutsa mafoni a foni ndi mabokosi a mkaka wobiriwira 
/scratch/skscla001/speech/data/nyagen/audio/221114-083438_nya_626_elicit_13.wav	mayi wamkulu akugwiritsa ntchito manja pamene mtsikanayo atakhala pansi n kumayang ana 
/scratch/skscla001/speech/data/nyagen/audio/221026-115610_nya_394_elicit_29.wav	mkazi watsitsi labulauni wovala ubweya wabuluu amakhala pafupi ndi mkazi watsitsi loyera 
/scratch/skscla001/speech/data/nyagen/audio/221030-131635_nya_394_elicit_12.wav	agalu atatu amitundu yosiyanasiyana ya bulauni ndi yoyera akuluma ndi kunyambitirana 
/scratch/skscla001/speech/data/nyagen/audio/221030-125341_nya_394_elicit_45.wav	bambo wina wovala suti akuyenda mumsewu atanyamula chikwama cha pepala chabulauni 
/scratch/skscla001/speech/data/nyagen/audio/221114-081628_nya_626_elicit_9.wav	galu woyera akuwomba mumtsinje wakunja pafupi ndi gombe laudzu 
/scratch/skscla001/speech/data/nyagen/audio/221029-184356_nya_394_elicit_40.wav	mayi wachikulire akuyang ana kamera pamene ana aang ono akusewera ndi zoseweretsa zamitundumitundu kuzungulira chipinda chakumbuyo 
/scratch/skscla001/speech/data/nyagen/audio/221111-202609_nya_626_elicit_13.wav	mzimayi wovala zolimbitsa thupi za buluu komanso chisoti akukwera m njira yadothi 
/scratch/skscla001/speech/data/nyagen/audio/221018-113735_nya_e3d_elicit_2.wav	bambo wina wovala malaya amizeremizere ndi magalasi a maso akukambirana pa telefoni ali m chipinda chake 
/scratch/skscla001/speech/data/nyagen/audio/221114-063718_nya_626_elicit_23.wav	mwamuna wovala jinzi ndi t sheti akuimbira gitala mayi ndi mwana yemwe akumwetulira atakhala pa masitepe pafupi ndi mabaluni ofiira ndi malalanje 
/scratch/skscla001/speech/data/nyagen/audio/221111-180028_nya_394_elicit_21.wav	mzibambo ndi ka mtsikana imirira mokodwa kusogolo kwa ngolo yawo pa maliketi 
/scratch/skscla001/speech/data/nyagen/audio/221111-190309_nya_394_elicit_1.wav	mzibambo wa cimwenye mu magalasi am maso ndi malaya akonza zakudya zina 
/scratch/skscla001/speech/data/nyagen/audio/221110-230544_nya_626_elicit_20.wav	mwamuna ndi mkazi akugwira anyamata awiri achichepere atakhala pabenchi ya m paki akujambula chithunzi 
/scratch/skscla001/speech/data/nyagen/audio/221023-170816_nya_394_elicit_6.wav	mtsikana wina wovala malaya otuwa komanso chipewa cha chigaza cha pinki waima m khichini akukunkhulira chakudya m poto 
/scratch/skscla001/speech/data/nyagen/audio/221111-185040_nya_394_elicit_49.wav	anthu awiri acisilani mzimai ndi mzibambo akhala onse pusongolo pazenera ya galasi 
/scratch/skscla001/speech/data/nyagen/audio/221114-082649_nya_626_elicit_20.wav	wosewera pa skateboarder atanyamula bolodi lake akuyenda mumlengalenga ali ndi zingwe za magetsi okwera kwambiri kumbuyo kwake 
/scratch/skscla001/speech/data/nyagen/audio/221028-171512_nya_394_elicit_3.wav	mnyamata wovala t sheti yoyera wagwada pansi akujambula apulo pafupi ndi chithunzi cha diso lalikulu 
/scratch/skscla001/speech/data/nyagen/audio/221101-114800_nya_394_elicit_25.wav	munthu wovala malaya ofiira amalumpha pamwamba pamiyala ndi udzu 
/scratch/skscla001/speech/data/nyagen/audio/221101-113540_nya_394_elicit_38.wav	amuna awiri ovala matumba abulauni aima mumsewu kutsogolo kwa khola lokhala ndi masamba a masamba pamwamba pake m modzi wa iwo atanyamula ndodo yachikasu 
/scratch/skscla001/speech/data/nyagen/audio/221113-012250_nya_626_elicit_15.wav	bamboyo ali ndi galu pa chingwe ndipo akuwoneka kuti akumuphunzitsa kuyima ndi miyendo yakumbuyo 
/scratch/skscla001/speech/data/nyagen/audio/221030-145157_nya_394_elicit_48.wav	mayi wovala malaya achikasu kuseri kwa kauntala yakunja akumwetulira ndikupereka chizindikiro chamtendere 
/scratch/skscla001/speech/data/nyagen/audio/221022-150736_nya_394_elicit_42.wav	mwamuna wavala chigoba chagolide ndi tsitsi lake lopindika komanso malaya achikasu 
/scratch/skscla001/speech/data/nyagen/audio/221113-080157_nya_394_elicit_13.wav	galu wamkulu wabulauni amakwera mpanda wautali pamene anthu atatu akuyang ana 
/scratch/skscla001/speech/data/nyagen/audio/221111-182436_nya_394_elicit_29.wav	kavalo ofiira ndi mtsikana wachizungu mu malaya akuda ayangana moto m mbiya 
/scratch/skscla001/speech/data/nyagen/audio/221110-230544_nya_626_elicit_27.wav	munthu wovala malaya akuda ndi tutu wakuda akusefukira ndi manja kumutu ndi anthu kumbuyo 
/scratch/skscla001/speech/data/nyagen/audio/221101-141218_nya_394_elicit_45.wav	bambo wina wokhala ndi magalasi ndi ndevu wakhala pafupi ndi mtsikana yemwe ali ndi juzi lapinki kutsogolo kwawo kuli ana atatu 
/scratch/skscla001/speech/data/nyagen/audio/221101-124651_nya_394_elicit_6.wav	wosewera wankhonya wokhala ndi chisoti chofiyira wapopera madzi mkamwa ndi mphunzitsi wake mubwalo lankhonya 
/scratch/skscla001/speech/data/nyagen/audio/221029-190025_nya_394_elicit_42.wav	bambo wina akumwetulira kwinaku akugunda mabotolo a ale ndi munthu wosaoneka pamalo opezeka anthu ambiri 
/scratch/skscla001/speech/data/nyagen/audio/221029-175401_nya_394_elicit_16.wav	bambo wachikulire atavala kabudula akuwonetsa miyendo yowoneka bwino akukwera panjinga wayima panjira 
/scratch/skscla001/speech/data/nyagen/audio/221030-154054_nya_394_elicit_25.wav	mwamuna wovala chijasi chakuda cholemera akusuta ndudu waima pafupi ndi mayi wovala jekete labulauni ali ndi pepala m manja mwake 
/scratch/skscla001/speech/data/nyagen/audio/221111-234816_nya_626_elicit_3.wav	mnyamata wakwera njonjo ya blue ndi yellow merry go round ndi dzanja la mwamuna wamkulu kutsogolo 
/scratch/skscla001/speech/data/nyagen/audio/221101-111209_nya_394_elicit_30.wav	dj yemwe ali ndi zomvera m makutu akusuntha ziboda m mwamba ndi pansi pa zida zake za dj 
/scratch/skscla001/speech/data/nyagen/audio/221028-145922_nya_394_elicit_18.wav	munthu wovala chipewa chofiyira komanso nsapato akuchita zinthu modzidzimutsa panjinga yofiyira pomwe munthu wovala mawotchi achikasu 
/scratch/skscla001/speech/data/nyagen/audio/221112-004306_nya_626_elicit_6.wav	mtsikana yemwe wakhala pafupi ndi bambo yemwe wavala t shirt yoyera akudya zokazinga zachi french 
/scratch/skscla001/speech/data/nyagen/audio/221029-163752_nya_394_elicit_0.wav	mayi wachikulire atavala chovala chamaluwa chokhala ndi maluwa akugwedeza chakudya m migolo ikuluikulu 
/scratch/skscla001/speech/data/nyagen/audio/221030-133842_nya_394_elicit_7.wav	bambo akuyenda kutsogolo kwa kanyumba ka basi komwe kapakidwa utoto wopopera 
/scratch/skscla001/speech/data/nyagen/audio/221029-161925_nya_394_elicit_22.wav	wosambira akupalasa ndi manja ake kuti atengere bwato lake m madzi 
/scratch/skscla001/speech/data/nyagen/audio/221111-235753_nya_626_elicit_37.wav	gulu la anthu lasonkhana m mphepete mwa sitolo pafupi ndi msewu womwe uli ndi zinyalala 
/scratch/skscla001/speech/data/nyagen/audio/221030-172350_nya_394_elicit_49.wav	woyimba watsitsi lalitali wachimuna akuimba piyano 
/scratch/skscla001/speech/data/nyagen/audio/221111-235753_nya_626_elicit_44.wav	mtsikana wina wamng ono atavala pinki akuyang ana wina yemwenso atavala pinki adalumpha pa trampoline 
/scratch/skscla001/speech/data/nyagen/audio/221114-065237_nya_626_elicit_3.wav	bambo wina wovala mathalauza a m madzi ndi ma flip flops ofanana amakoka ngolo yonyamula matsache opangidwa ndi manja mumsewu 
/scratch/skscla001/speech/data/nyagen/audio/221030-132751_nya_394_elicit_25.wav	kwaya ikuimba ndi woyimba payekha kutsogolo ndi kondakitala atavala diresi lakuda ndi loyera 
/scratch/skscla001/speech/data/nyagen/audio/221029-184356_nya_394_elicit_4.wav	mayi wovala juzi lapinki akusonyeza mayi wina masambawo 
/scratch/skscla001/speech/data/nyagen/audio/221112-004306_nya_626_elicit_43.wav	galu watsitsi lagolide akuthamanga panjira yofiyira pomwe anthu amangoyang ana pafupi 
/scratch/skscla001/speech/data/nyagen/audio/221114-054111_nya_626_elicit_36.wav	galu akusambira m madzi ena momwe muli abakha ena akusambira nawonso 
/scratch/skscla001/speech/data/nyagen/audio/221112-003159_nya_626_elicit_10.wav	mwana wovala chijasi chofiyira ndi chipewa chanyamula chipale chofewa chachikulu 
/scratch/skscla001/speech/data/nyagen/audio/221030-123234_nya_394_elicit_43.wav	pali wosewera mpira wa malaya achikasu akuthamanga pakati pa bwalo 
/scratch/skscla001/speech/data/nyagen/audio/221102-094510_nya_510_elicit_46.wav	oyenda panyanja awiri akugwira mafunde aakulu omwewo panyanja 
/scratch/skscla001/speech/data/nyagen/audio/221113-084828_nya_394_elicit_25.wav	mtsikana wovala nyenyezi ndi mikwingwirima akusamba suti akutembenuzira kumbuyo kugombe 
/scratch/skscla001/speech/data/nyagen/audio/221114-053225_nya_626_elicit_7.wav	kamtsikana kamutu komwetulira kakumwetulira kakugona pansi ndi mimba n kuyang ana m mwamba pamene mzera wa mafumu ukukhala pambali pake 
/scratch/skscla001/speech/data/nyagen/audio/221113-002910_nya_626_elicit_0.wav	ana ang onoang ono atatu amasewera m mwamba m nthambi za mtengo womwe ukuphuka pafupi ndi nyumba yaikulu ya njerwa 
/scratch/skscla001/speech/data/nyagen/audio/221018-113735_nya_e3d_elicit_17.wav	wosewera mpira wa hockey mu jezi yofiyira akutenga chakumwa kuchokera mu botolo lamasewera 
/scratch/skscla001/speech/data/nyagen/audio/221114-081628_nya_626_elicit_3.wav	mwana wamng ono wovala jeans ya buluu ndi malaya abuluu a navy akukwera njinga ndi mawilo ophunzitsira 
/scratch/skscla001/speech/data/nyagen/audio/221028-152630_nya_394_elicit_6.wav	wosewera mpira wachinyamata wakuda atavala yunifolomu yofiirira ali ndi mpira kumutu komanso wosewera mpira wachizungu wovala yunifolomu yoyera kumbuyo kwake 
/scratch/skscla001/speech/data/nyagen/audio/221022-142238_nya_394_elicit_26.wav	akazi awiri akudya patebulo ndi nkhunda zambiri mumsewu pafupi ndi iwo 
/scratch/skscla001/speech/data/nyagen/audio/221101-124651_nya_394_elicit_40.wav	munthu waima pafupi ndi mzere wa njinga zofanana zofiira ndi zoyera 
/scratch/skscla001/speech/data/nyagen/audio/221113-094807_nya_394_elicit_22.wav	kwaya yovala zoyera ndi zakuda ikuimba pa siteji 
/scratch/skscla001/speech/data/nyagen/audio/221112-004306_nya_626_elicit_34.wav	mwana wamng ono wanyamula mtanga wa mazira a isitala amitundu yowala bwino ndipo akutola lapinki paudzu 
/scratch/skscla001/speech/data/nyagen/audio/221030-131635_nya_394_elicit_10.wav	mnyamata wovala jekete lofiira akugwiritsa ntchito nyanga ya ng ombe kufuula kutsogolo kwa mbendera yaikulu yotsutsa 
/scratch/skscla001/speech/data/nyagen/audio/221110-230544_nya_626_elicit_19.wav	mwamuna wovala vest yachikasu ndi chipewa chokhala ndi mapini akuyang ana chinachake 
/scratch/skscla001/speech/data/nyagen/audio/221101-144049_nya_394_elicit_33.wav	wina ali padenga akudumphira pa bolodi logwidwa mumlengalenga 
/scratch/skscla001/speech/data/nyagen/audio/221027-134220_nya_510_elicit_46.wav	atsikana awiri ang onoang ono akuwoneka kuti akusangalala ndi mulu wa masamba pamene akumwetulira kamera 
/scratch/skscla001/speech/data/nyagen/audio/221023-130745_nya_394_elicit_45.wav	atsikana angapo ovala zovala zosambira akusewera mu kasupe wa sprinkler 
/scratch/skscla001/speech/data/nyagen/audio/221030-151347_nya_394_elicit_5.wav	bambo wamaliseche nthawi zambiri atayima pa chopondapo pomwe banja la anthu asanu likuyang ana mofunsa mafunso 
/scratch/skscla001/speech/data/nyagen/audio/221114-061605_nya_626_elicit_1.wav	kamnyamata ka malaya abuluu ndi kamsungwana kakang ono kovala pinki akusewera mu udzu wobiriwira 
/scratch/skscla001/speech/data/nyagen/audio/221002-191144_nya_97d_elicit_14.wav	tsitsi la mtsikana limakwiririka pamene akukwera masitepe pa skateboard 
/scratch/skscla001/speech/data/nyagen/audio/221113-001849_nya_626_elicit_23.wav	mayi woledzera atavala chovala cha buluu zothina zakuda ndi mapampu achikopa akuda atagona pampando akusuta fodya akuseka 
/scratch/skscla001/speech/data/nyagen/audio/221113-152024_nya_626_elicit_32.wav	mwanayo akuvomereza kuti amayi ake amasangalala ndi magalasi awo oyendetsa ndege 
/scratch/skscla001/speech/data/nyagen/audio/221113-011513_nya_626_elicit_10.wav	galu wakuda ndi woyera akudumpha chopinga chofiira ndi choyera pa kapinga ndi agalu ena ndi anthu 
/scratch/skscla001/speech/data/nyagen/audio/221030-141802_nya_394_elicit_5.wav	a dark haired latino boy in jeans running past a wall covered with graffiti 
/scratch/skscla001/speech/data/nyagen/audio/221114-054111_nya_626_elicit_20.wav	galu woyera agalu awiri akuda ndi galu wakuda ndi woyera akusewera m mphepete mwa bwalo la baseball 
/scratch/skscla001/speech/data/nyagen/audio/221026-102358_nya_394_elicit_47.wav	wosewera mpira wa basketball wokhala ndi thirty two atavala jeresi adalumpha kuti awombere anthu ambiri kumbuyo 
/scratch/skscla001/speech/data/nyagen/audio/221022-150736_nya_394_elicit_19.wav	poyang anizana ndi malo owoneka bwino kuchokera kuphiri lalitali mayi akujambulidwa atavala chisoti chokwera njinga ndi magalasi adzuwa 
/scratch/skscla001/speech/data/nyagen/audio/221028-181315_nya_394_elicit_46.wav	ana atatu ovala mayunifolomu obiriwira achikasu ndi abuluu akhala ndi kuyimirira pafupi ndi amayi awiri 
/scratch/skscla001/speech/data/nyagen/audio/221027-125834_nya_510_elicit_29.wav	mayi wina wovala jinzi ya buluu ndi jekete labulauni akuyenda mumsewu wa mumzinda 
/scratch/skscla001/speech/data/nyagen/audio/221114-090743_nya_626_elicit_47.wav	mayi wovala chipewa choyera akuyang ana mmwamba pamene akukhazika pansi khoma lalikulu la mwala 
/scratch/skscla001/speech/data/nyagen/audio/221110-230544_nya_626_elicit_49.wav	mayiyo akuuluza makoko a duwa la m munda wobiriwira 
/scratch/skscla001/speech/data/nyagen/audio/221111-185040_nya_394_elicit_23.wav	ana awiri mtsikana ndi mnyamata ayeserera zolemba zawo 
/scratch/skscla001/speech/data/nyagen/audio/221101-114800_nya_394_elicit_23.wav	atsikana awiri omwe ali ndi ana awiri akuyenda pamene anthu ena akuyandikira kuphatikizapo mwamuna wokwera bulu yemwenso ali ndi bulu wina yemwe akumutsatira 
/scratch/skscla001/speech/data/nyagen/audio/221029-190025_nya_394_elicit_49.wav	mwamuna wovala zovala waima kumbuyo kwa kauntala 
/scratch/skscla001/speech/data/nyagen/audio/221110-142630_nya_626_elicit_40.wav	woyimbira masewero a mpira wa miyendo amagwada kuti agwire mpira pamene wopikisana naye akuthamangira kunyumba 
/scratch/skscla001/speech/data/nyagen/audio/221030-141802_nya_394_elicit_45.wav	mtsikana wina akuyang ana munthu wamkulu pamene akuyesera kuvina pabwalo lamasewera 
/scratch/skscla001/speech/data/nyagen/audio/221112-003159_nya_626_elicit_13.wav	galimoto yoyaka moto yofiira yayimitsidwa pafupi ndi gulu la anthu ndi ana omwe aima mumsewu 
/scratch/skscla001/speech/data/nyagen/audio/221113-081436_nya_394_elicit_13.wav	galu wothamanga akuthawa atavala jeresi yachikasu ndi yakuda komanso pamphuno 
/scratch/skscla001/speech/data/nyagen/audio/221026-113140_nya_394_elicit_25.wav	mwamuna akuwerenga nyuzipepala pansi pa mbendera yobiriwira yomwe imati la suma de todos 
/scratch/skscla001/speech/data/nyagen/audio/221111-222234_nya_626_elicit_7.wav	bambo wina amene ali ndi chakumwa cham chitini waima pansi pa mathithi 
/scratch/skscla001/speech/data/nyagen/audio/221114-053225_nya_626_elicit_12.wav	kuwonekera kawiri kwa khanda loseka lomwe lili ndi tsitsi lopindika lofiirira komanso nsalu yotchinga yamaluwa 
/scratch/skscla001/speech/data/nyagen/audio/221111-222234_nya_626_elicit_16.wav	bambo wina wovala jekete la buluu atakwera galu akuwolokera pa chigwa chokutidwa ndi chipale chofewa 
/scratch/skscla001/speech/data/nyagen/audio/221111-000606_nya_626_elicit_17.wav	munthu wovala malaya oyera akupera skateboard pansi pa njanji yayitali pamalo ochitira masewera olimbitsa thupi 
/scratch/skscla001/speech/data/nyagen/audio/221111-214633_nya_626_elicit_15.wav	galu akugudubuzika chagada pa udzu ndi kukamwa 
/scratch/skscla001/speech/data/nyagen/audio/221114-084253_nya_626_elicit_5.wav	mwamuna wovala mphete ya ng ombe akumuthamangitsa 
/scratch/skscla001/speech/data/nyagen/audio/221114-065237_nya_626_elicit_29.wav	mnyamata yemwe ali pamutu wofiyira akutsatira msungwana wovala zovala zowoneka bwino pamasitepe owuluka 
/scratch/skscla001/speech/data/nyagen/audio/221028-164914_nya_510_elicit_42.wav	mnyamata wina wowoneka ku middle east watsekeredwa mu khola lagalasi lodzaza ndi ma pretzels 
/scratch/skscla001/speech/data/nyagen/audio/221028-145922_nya_394_elicit_48.wav	wamng ono wokwera njinga uyu watulutsa manja ake pamene akuyesera njira iyi 
/scratch/skscla001/speech/data/nyagen/audio/221030-124227_nya_394_elicit_27.wav	womangayo akubowola mumsewu pafupi ndi msewu wokhala ndi anthu ambiri 
/scratch/skscla001/speech/data/nyagen/audio/221101-113540_nya_394_elicit_45.wav	msungwana wamng ono wovala chovala chachikasu akudumpha pa chingwe chofiira ndi chobiriwira 
/scratch/skscla001/speech/data/nyagen/audio/221026-111146_nya_394_elicit_27.wav	owotcherera amapanga zidutswa zina za nyumba yabwino yomwe ili ndi maambulera alalanje 
/scratch/skscla001/speech/data/nyagen/audio/221113-010439_nya_626_elicit_43.wav	womanga akutsamira chitoliro chachikasu akumaoneka ngati akupempha kanthu 
/scratch/skscla001/speech/data/nyagen/audio/221113-091210_nya_394_elicit_7.wav	mnyamata yemwe ali ndi toboggan ndi mtsikana akujambula kamera 
/scratch/skscla001/speech/data/nyagen/audio/221030-171304_nya_394_elicit_23.wav	gulu lamasewera likuima pabwalo pomwe pali anthu kumbuyo 
/scratch/skscla001/speech/data/nyagen/audio/221111-214633_nya_626_elicit_47.wav	bambo wa jekete la imvi ndi magalasi ofiira ali ndi makamera ndipo waima kutsogolo kwa galimoto 
/scratch/skscla001/speech/data/nyagen/audio/221113-010439_nya_626_elicit_23.wav	wogwira ntchito pabwalo akudula udzu ndi makina otchetcha udzu agule msewu wokhala ndi anthu ambiri komanso malo oimika magalimoto 
/scratch/skscla001/speech/data/nyagen/audio/221111-233812_nya_626_elicit_24.wav	mnyamata wina wovala malaya amizeremizere yakuda ndi yoyera akutsamira pa udzu pamene magalimoto akudutsa pafupi ndi msewu 
/scratch/skscla001/speech/data/nyagen/audio/221030-164539_nya_394_elicit_26.wav	wogwira ntchito amatsuka m mbali mwa msewu kunja kwa malo ozunguliridwa ndi mpanda wachitsulo 
/scratch/skscla001/speech/data/nyagen/audio/221113-081436_nya_394_elicit_12.wav	mayi wina wovala magiya okwera pamahatchi ofiira oyera ndi akuda ataimirira pafupi ndi bambo wina wachikulire wovala zofananira naye yemwe wakwera hatchi yabulauni panjira yadothi 
/scratch/skscla001/speech/data/nyagen/audio/221101-142343_nya_394_elicit_26.wav	a dali lama pamwambo wolandira anthu omwe abwera nawo abweretsa ma carnations parasols ndi mbendera za mapemphero 
/scratch/skscla001/speech/data/nyagen/audio/221014-113054_nya_8a1_elicit_8.wav	mnyamata pa skateboard ali pa khoma pafupi ndi madzi ndi pafupi ndi udzu 
/scratch/skscla001/speech/data/nyagen/audio/221111-001809_nya_626_elicit_24.wav	munthu wovala zovala zoyera komanso zotchingira miyendo yoyera akuchita masewera olimbitsa thupi 
/scratch/skscla001/speech/data/nyagen/audio/221111-233812_nya_626_elicit_21.wav	mnyamata watsitsi lakuda wovala malaya abuluu mpango wobiriwira ndi magalasi akupanga mbale pagudumu ladothi 
/scratch/skscla001/speech/data/nyagen/audio/221114-062550_nya_626_elicit_0.wav	msika wamsewu kumene katundu wa zipatso ndi ndiwo zamasamba akugulitsidwa ndi amuna atatu wina atavala malaya oyera a manja aatali ndi macheke apansi wotsatira atavala malaya achikasu ndi macheki obiriwira ndipo womaliza ali ofiira 
/scratch/skscla001/speech/data/nyagen/audio/221030-163139_nya_394_elicit_7.wav	mnyamata wovala yunifolomu ya baseball ndi thalauza loyera chipewa choyera ndi malaya achikasu ndi nambala fourteen kumbuyo akukweza mwendo wake wakumanzere 
/scratch/skscla001/speech/data/nyagen/audio/221113-002910_nya_626_elicit_47.wav	galu wamchenga wabulauni akuseweretsa mpira panja 
/scratch/skscla001/speech/data/nyagen/audio/221023-130745_nya_394_elicit_47.wav	mkwatibwi atavala chovala choyera ndi nsapato zoyera atanyamula maluwa a maluwa ndipo mkwati wavala tuxedo yakuda buluu onse aimirira moyang anizana ndi mtengo wanyale wabuluu 
/scratch/skscla001/speech/data/nyagen/audio/221029-125840_nya_394_elicit_42.wav	kamnyamata kakugwada pansi ndikukankhira chidole m mphepete mwa msewu 
/scratch/skscla001/speech/data/nyagen/audio/221114-054111_nya_626_elicit_2.wav	galu wakuda ndi woyera akuthamangitsa galu wamkulu paudzu 
/scratch/skscla001/speech/data/nyagen/audio/221111-213342_nya_626_elicit_29.wav	wotsukira zenera akugwira kapu yoyamwa kuti azithandizira kukwapula pawindo lagalasi 
/scratch/skscla001/speech/data/nyagen/audio/221114-055325_nya_626_elicit_20.wav	uyu ndi dona yemwe wavala chovala cha buluu wavala nsapato zoyera ndi blue shoes atanyamula racket ya tenisi m manja mwake 
/scratch/skscla001/speech/data/nyagen/audio/221029-161925_nya_394_elicit_1.wav	ana awiri ovala zipewa za baseball akugwirana chanza ataima m mphepete mwa msewu 
/scratch/skscla001/speech/data/nyagen/audio/221030-165931_nya_394_elicit_32.wav	pali mahatchi asanu ndi umodzi omwe akukwera m bwalo lanjanji lomwe lili ndi mapiri kumbuyo ndipo anthu akutsogolo akuwonera 
/scratch/skscla001/speech/data/nyagen/audio/221112-003159_nya_626_elicit_0.wav	bambo wina wovala t sheti yabuluu akupachika chinthu padenga lalitali mopanda chitetezo ataima pansanjika ya lift 
/scratch/skscla001/speech/data/nyagen/audio/221030-155230_nya_394_elicit_27.wav	anthu awiri adasonkhana pakhomo wina akuwoneka kuti ndi dokotala kuchokera pamwamba pake ndipo winayo ndi mtsikana wamng ono wovala magalasi mwina wazaka zisanu ndi ziwiri kapena zisanu ndi zitatu yemwe ali ndi zida zamtundu wina kutsogolo kwake zomwe zingakhale zothandiza thanzi lake 
/scratch/skscla001/speech/data/nyagen/audio/221021-224449_nya_394_elicit_35.wav	gulu la masewera a karati ena ovala yunifolomu ndipo ena alibe zomwe zikuchitika panja 
/scratch/skscla001/speech/data/nyagen/audio/221029-181608_nya_394_elicit_47.wav	bambo akuyang ana pagalasi la telescope usiku atavala jekete yobisalira 
/scratch/skscla001/speech/data/nyagen/audio/221101-145402_nya_394_elicit_44.wav	mtsikana wina watsitsi labulauni akugwedezeka atavala suti yosambira 
/scratch/skscla001/speech/data/nyagen/audio/221113-002910_nya_626_elicit_27.wav	bambo akukwera mwala ndi chingwe cholendewera pansi ndi zida zodzitetezera m chiuno mwake 
/scratch/skscla001/speech/data/nyagen/audio/221113-082401_nya_394_elicit_42.wav	mtsikana wovala tutu wapinki akugwira dzanja lake pabedi 
/scratch/skscla001/speech/data/nyagen/audio/221114-054111_nya_626_elicit_47.wav	kamwana kakang ono ka ku asia akugwada pansi ndikuyang ana mu kamera 
/scratch/skscla001/speech/data/nyagen/audio/221114-070800_nya_626_elicit_40.wav	agalu awiri akusewera ndikuwoneka akukumbatirana mu chipale chofewa 
/scratch/skscla001/speech/data/nyagen/audio/221112-183906_nya_394_elicit_29.wav	mzibambo ali ndi conyulila can mpanda aimilira pafupi ndi baketi muli misambo pa malo a manyumba zing ono zing ono 
/scratch/skscla001/speech/data/nyagen/audio/221030-155230_nya_394_elicit_10.wav	mayi wovala apuloni amayang ana mphika waukulu patebulo lodzaza makapu mbale miphika ndi madengu osiyanasiyana 
/scratch/skscla001/speech/data/nyagen/audio/221114-063718_nya_626_elicit_42.wav	gulu la anthu laima patsogolo pa galimoto yonyamula zakudya n kumagula chinachake 
/scratch/skscla001/speech/data/nyagen/audio/221030-115956_nya_394_elicit_15.wav	galu woyera pa chingwe chobiriwira akuyimirira ndi miyendo yake yakumbuyo kuyang ana khoma lamwala 
/scratch/skscla001/speech/data/nyagen/audio/221113-080157_nya_394_elicit_44.wav	munthu wometedwa mutu atavala malaya aids kuyenda akuyang ana pa laputopu 
/scratch/skscla001/speech/data/nyagen/audio/221028-162153_nya_394_elicit_10.wav	gulu la anthu ovala zikwama akulowera kumapiri chapatali panjira panjapo 
/scratch/skscla001/speech/data/nyagen/audio/221111-183608_nya_394_elicit_18.wav	mzibambo mu malaya akuda ndi tsitsi lalitali akuimba gitala ili ndi zomata 
/scratch/skscla001/speech/data/nyagen/audio/221112-003159_nya_626_elicit_21.wav	amuna aku asia amakhala osalowerera ndale ngati akuyembekezera chinachake bambo wina akulankhula pa foni yake 
/scratch/skscla001/speech/data/nyagen/audio/221111-190309_nya_394_elicit_26.wav	mnyamata wocepa ajumpa madzi omwe akutilila pansi 
/scratch/skscla001/speech/data/nyagen/audio/221113-082401_nya_394_elicit_3.wav	kumbuyo kwa mzimayi wovala jekete yoyera ndi jinzi ya buluu akuyenda kupita kugulu la mbalame 
/scratch/skscla001/speech/data/nyagen/audio/221112-003159_nya_626_elicit_43.wav	sitima yapamadzi yaikulu imadutsa m mphepete mwa nyanja kumene owotchera dzuwa amakhala pansi pa maambulera achikasu 
/scratch/skscla001/speech/data/nyagen/audio/221110-230544_nya_626_elicit_4.wav	kamtsikana kakang ono kakang ono ka tsitsi la blond atavala malaya apinki akuyenda kuchoka kumunda wa topiary kumene mpanda wadulidwa kuti uwoneke ngati ladybug 
/scratch/skscla001/speech/data/nyagen/audio/221114-073420_nya_626_elicit_26.wav	wokwera chipale chofewa mu chovala choyera mumlengalenga atadumpha 
/scratch/skscla001/speech/data/nyagen/audio/221113-012250_nya_626_elicit_12.wav	wankhonya wovala zazifupi zoyera ndi magolovesi ofiira akumenya nkhonya wina wovala buluu kumaso 
