audio	sentence
/scratch/skscla001/speech/data/nyagen/audio/221113-073822_nya_394_elicit_4.wav	mayi wina wovala ngati munthu wanthabwala akuyesa kukopa chidwi cha anthu atatu osawadziwa pamene onse akukhala pabenchi m malo ogulitsira zinthu 
/scratch/skscla001/speech/data/nyagen/audio/221028-171512_nya_394_elicit_0.wav	bambo wachikulire atavala magalasi adzuwa chipewa ndi jekete lachikopa amaimba lipenga pa tsiku lagwa 
/scratch/skscla001/speech/data/nyagen/audio/221113-173115_nya_626_elicit_23.wav	mayi wina wovala malaya akuda ndi apuloni ali kalikiliki kuyeza nsomba pa sikelo pa msika wa nsomba ndipo kutsogolo kwake kunali nyama zosiyanasiyana za nsomba 
/scratch/skscla001/speech/data/nyagen/audio/221101-113540_nya_394_elicit_2.wav	agalu awiri akukodza pa bomba lozimitsa moto lofiira 
/scratch/skscla001/speech/data/nyagen/audio/221101-152830_nya_394_elicit_43.wav	mayi wina wovala malaya apinki ndi kabudula wa khaki akuyang ana pa mwala womwe ukugwa moyang anizana ndi nkhalango yaikulu 
/scratch/skscla001/speech/data/nyagen/audio/221110-233958_nya_626_elicit_40.wav	pali bambo wina wa tsitsi la imvi atavala jekete yakuda ndi ya lalanje atakhala pampando m mphepete mwa msewu akusewera accordion 
/scratch/skscla001/speech/data/nyagen/audio/221114-081628_nya_626_elicit_16.wav	wokwera m chipale chofewa amadumpha pa chipale chofewa choyera 
/scratch/skscla001/speech/data/nyagen/audio/221111-181340_nya_394_elicit_43.wav	munyamata mu malaya apinki ayendetsa njinga yamoto pa michanga youjika kenaka awiri ayendetsa pa mseu 
/scratch/skscla001/speech/data/nyagen/audio/221113-004108_nya_626_elicit_28.wav	mwamuna wovala thukuta lofiira ali ndi tsitsi lake mu dreadlocks 
/scratch/skscla001/speech/data/nyagen/audio/221022-135414_nya_394_elicit_7.wav	galu wabulauni ndi wakuda akuthamanga paudzu panja panja panjira 
/scratch/skscla001/speech/data/nyagen/audio/221111-182436_nya_394_elicit_16.wav	mtsikana wa tsitsi lofiira wagwira botolo ndipo wabvala malaya osambila amaluwa a buluu ndi gilini pa bwato 
/scratch/skscla001/speech/data/nyagen/audio/221114-062550_nya_626_elicit_5.wav	gulu la achinyamata likusewera ndi mfuti zamadzi n kuima kutsogolo kwa lole yoyera 
/scratch/skscla001/speech/data/nyagen/audio/221026-113140_nya_394_elicit_13.wav	mnyamata wanyamula chidole chofiyira atavala munthu wobiriwira wa chipale chofewa komanso zovala zogona za mphalapala ali ndi mayi wachikulire pampando kumbuyo kwake 
/scratch/skscla001/speech/data/nyagen/audio/221110-230544_nya_626_elicit_40.wav	galu wamtali wabulauni akumwa madzi patebulo pamene galu wakuda akudumpha kuchoka patebulopo 
/scratch/skscla001/speech/data/nyagen/audio/221026-104953_nya_394_elicit_37.wav	bambo wina wovala magalasi wanyamula mkono wake mozungulira khanda la lalanje ndi lachikasu lomwe lili ndi thovu pamphuno 
/scratch/skscla001/speech/data/nyagen/audio/221022-191952_nya_510_elicit_22.wav	mzimayi wovala sweti yofiira ndi mtsikana ali kutsogolo kwa mtsikana yemwe ali ndi hoodie yobiriwira 
/scratch/skscla001/speech/data/nyagen/audio/221026-143340_nya_394_elicit_48.wav	wokwera m chipale chofewa atavala malaya akuda chipewa chakuda ndi mathalauza oyera akuyenda mozondoka pamene akukwera chipale chofewa pansi pa phiri 
/scratch/skscla001/speech/data/nyagen/audio/221028-131629_nya_394_elicit_24.wav	galu waku germany shepherd akudumpha mmwamba pamene akuphwanyidwa ndi jeti yamadzi 
/scratch/skscla001/speech/data/nyagen/audio/221114-082649_nya_626_elicit_17.wav	mwamuna wovala t shirt yoyera jeans yabuluu ndi nsapato za tenisi akuyima pazitsulo zazitsulo atagwira mawaya achitsulo aatali maso ake ali otsekedwa kumbuyo kuli nyanja kapena nyanja 
/scratch/skscla001/speech/data/nyagen/audio/221101-111209_nya_394_elicit_19.wav	chithunzichi chikusonyeza gulu la asilikali ovala zida za thupi ndi zishango zofiira 
/scratch/skscla001/speech/data/nyagen/audio/221110-142630_nya_626_elicit_17.wav	gulu la amuna ovala zipewa zoyera mkati mwa nyumba ya mafakitale wina akujambula chithunzi 
/scratch/skscla001/speech/data/nyagen/audio/221030-121119_nya_394_elicit_6.wav	kamnyamata kovala malaya amizeremizere akuloza chinachake 
/scratch/skscla001/speech/data/nyagen/audio/221114-061605_nya_626_elicit_0.wav	atsikana atatu ovala zoyera pinki ndi zakuda ali pakalasi yovina 
/scratch/skscla001/speech/data/nyagen/audio/221114-090743_nya_626_elicit_31.wav	mayi wina wovala jinzi ya buluu ndi malaya a creme akuyenda mumsewu atanyamula khasu kudzanja lake lamanja ndi magolovesi kudzanja lake lamanzere 
/scratch/skscla001/speech/data/nyagen/audio/221023-174803_nya_394_elicit_38.wav	munthu wovala yunifomu yabuluu waimitsidwa panyumba 
/scratch/skscla001/speech/data/nyagen/audio/221113-081436_nya_394_elicit_10.wav	wothamanga panjinga yamoto akukhota panjira yonyowa 
/scratch/skscla001/speech/data/nyagen/audio/221026-104953_nya_394_elicit_33.wav	anthu ambiri ovala ngati akatswiri ankhondo akuyenda mumsewu moyang anizana ndi malo ogulitsira mafuta 
/scratch/skscla001/speech/data/nyagen/audio/221030-145157_nya_394_elicit_44.wav	mtsikana wovala chovala chapinki akusewera pa kapinga wamkulu mpaka kukafika panyumba ina yaikulu chapatali 
/scratch/skscla001/speech/data/nyagen/audio/221111-234816_nya_626_elicit_48.wav	amuna angapo akusewera mpira wa basketball ku paki usiku 
/scratch/skscla001/speech/data/nyagen/audio/221111-181340_nya_394_elicit_37.wav	mzibambo wakhala pansi ndipo wayezekha mutu wake pa khonya pafupi ndi mzibambo omwe maso ake otsekha ndipo zopangila zakudya zili patebulo patsogolo pao onse awiri 
/scratch/skscla001/speech/data/nyagen/audio/221028-181315_nya_394_elicit_10.wav	mayi wovala magalasi ndi chipewa akulowetsa mutu wake pakhomo la tenti tsiku lachisanu 
/scratch/skscla001/speech/data/nyagen/audio/221030-125341_nya_394_elicit_39.wav	mayi akuyenda mumsewu womwe ukuwoneka ngati dziko lachitatu 
/scratch/skscla001/speech/data/nyagen/audio/221113-002910_nya_626_elicit_29.wav	nsalu yoyera ikunyamuka m madzi 
/scratch/skscla001/speech/data/nyagen/audio/221114-082649_nya_626_elicit_23.wav	bambo wina wovala malaya ofiira akuyang ana kudzanja lake lamanja pamene mayi wina wovala jekete lakuda ndi lobiriwira akuyenda kumbuyo kwake 
/scratch/skscla001/speech/data/nyagen/audio/221030-173405_nya_394_elicit_37.wav	galu akuyenda m madzi ndipo dzuwa likutuluka m madzimo 
/scratch/skscla001/speech/data/nyagen/audio/221111-201023_nya_626_elicit_36.wav	mnyamata watsegula pakamwa pamene akukwera njinga yake panja kudutsa khoma lamwala 
/scratch/skscla001/speech/data/nyagen/audio/221113-094807_nya_394_elicit_29.wav	mtsikana wovala chovala chakuda chokhala ndi lamba wofiyira komanso chovala chakuda chakumutu ali ndi dzanja limodzi m chiuno ndipo lina mowongoka 
/scratch/skscla001/speech/data/nyagen/audio/221030-163139_nya_394_elicit_46.wav	amuna awiri aima mwamphamvu pansi pa mathithiwo 
/scratch/skscla001/speech/data/nyagen/audio/221101-121530_nya_394_elicit_18.wav	wosambira panyanja akungoyenda pamlengalenga akukwera mafunde 
/scratch/skscla001/speech/data/nyagen/audio/221114-082649_nya_626_elicit_12.wav	galimoto yothamanga yomwe ikubwera mozungulira pamzere wa miyala imapanga fumbi lambiri 
/scratch/skscla001/speech/data/nyagen/audio/221111-191533_nya_394_elicit_49.wav	anthu ambiri acicepele amilira akumwa zokumwa ndi kudya zakudya pamalo oneka okumanilanapo 
/scratch/skscla001/speech/data/nyagen/audio/221113-010439_nya_626_elicit_24.wav	mbalame zingapo zokhala ndi malaya owerengeka zikuthamanga mozungulira njanji 
/scratch/skscla001/speech/data/nyagen/audio/221113-173115_nya_626_elicit_24.wav	akazi ovala zofiirira akuzungulira mkwati ndi mkwatibwi ndi akwatibwi kumbuyo 
/scratch/skscla001/speech/data/nyagen/audio/221101-144049_nya_394_elicit_35.wav	galu wabulauni ali m munda waudzu akudzizungulira kuti aone pansi pake 
/scratch/skscla001/speech/data/nyagen/audio/221023-130745_nya_394_elicit_21.wav	banja lina likukhala pa benchi ya m paki pamene mwamuna wina akugona ndi pepala kumaso kwake pa benchi pafupi ndi iwo 
/scratch/skscla001/speech/data/nyagen/audio/221111-235753_nya_626_elicit_47.wav	okwatirana ovala zovala zowala akuyenda manja ndi manja m mphepete mwa msewu 
/scratch/skscla001/speech/data/nyagen/audio/221030-133842_nya_394_elicit_36.wav	pali oimba ena ndi mwamuna wovala zoyera akusewera pa siteji 
/scratch/skscla001/speech/data/nyagen/audio/221030-151347_nya_394_elicit_26.wav	kamtsikana kakang ono ka thalauza la pinki ndi jekete la pinki pakati pa mulu wa mabotolo apulasitiki 
/scratch/skscla001/speech/data/nyagen/audio/221111-001809_nya_626_elicit_32.wav	mnyamata wanyamula chidebe chobiriwira pagombe lamchenga ndipo kumwamba kuli mitambo 
/scratch/skscla001/speech/data/nyagen/audio/221103-104838_nya_510_elicit_17.wav	mwamuna ndi mkazi amavala malaya akuda mu chipinda cha beige ndi moniter kumbuyo 
/scratch/skscla001/speech/data/nyagen/audio/221101-121530_nya_394_elicit_19.wav	amuna ena akugwira ntchito mozungulira bizinesi yamsewu marquis pali tepi yochenjeza imodzi mwa ma cones omwe ali ndi tepiyo idagundidwa 
/scratch/skscla001/speech/data/nyagen/audio/221029-190025_nya_394_elicit_30.wav	bambo wina wovala jekete lakuda ndi thalauza waima m malo obiriwira obiriwira atatulutsa manja ake 
/scratch/skscla001/speech/data/nyagen/audio/221026-152356_nya_394_elicit_19.wav	awiri am madzi pamadzi kutsogolo mbalame ali ndi chinthu anagwira mu mlomo 
/scratch/skscla001/speech/data/nyagen/audio/221026-152356_nya_394_elicit_22.wav	wosewera mpira wa tennis adalandira mpirawo ndipo potero adabweza mpirawo kwa mdani wake 
/scratch/skscla001/speech/data/nyagen/audio/221113-001849_nya_626_elicit_47.wav	bambo wachikulire atayima kumbuyo kwa chipinda chodzaza kwambiri 
/scratch/skscla001/speech/data/nyagen/audio/221029-181608_nya_394_elicit_37.wav	mnyamata watsitsi la blond waima pa siteji akuimba gitala yofiira ndi woyimba ng oma kumbuyo kwake 
/scratch/skscla001/speech/data/nyagen/audio/221030-164539_nya_394_elicit_33.wav	azimayi ovala zamaluwa madiresi achikhalidwe akuima mozungulira mbiya ya mkate pa malonda akunja 
/scratch/skscla001/speech/data/nyagen/audio/221029-161925_nya_394_elicit_45.wav	mtsikana wovala malaya ofiira akuwomba m manja pamene ana ena akusewera 
/scratch/skscla001/speech/data/nyagen/audio/221112-005507_nya_626_elicit_37.wav	chonyamulira chopanda kanthu komanso chonyamulira chomwe chili ndi anthu awiri chikusuntha 
/scratch/skscla001/speech/data/nyagen/audio/221028-173712_nya_394_elicit_17.wav	kamwana kakhala kakusewera ndi zokongoletsa m munda wawung ono 
/scratch/skscla001/speech/data/nyagen/audio/221111-235753_nya_626_elicit_6.wav	anyamata anayi akusewera mpira kutsogolo kwa zitseko zazikulu zokongola 
/scratch/skscla001/speech/data/nyagen/audio/221023-163538_nya_394_elicit_26.wav	mwamuna wovala zoyera atadzikweza yekha pa mphete za olimpiki akugawanitsa 
/scratch/skscla001/speech/data/nyagen/audio/221113-012250_nya_626_elicit_6.wav	kamwana kakang ono ka njinga yamoto katatu kamaoneka kuti sanavale zovala 
/scratch/skscla001/speech/data/nyagen/audio/221030-114647_nya_394_elicit_13.wav	wopambana wa olimpiki atavala mendulo zake ziwiri zagolide ndi jekete yotuwa yowonetsa chizindikiro chamtendere komanso kugwedezeka 
/scratch/skscla001/speech/data/nyagen/audio/221114-054111_nya_626_elicit_4.wav	pali konsati munthu waima pa siteji akuyang ana pansi 
/scratch/skscla001/speech/data/nyagen/audio/221030-172350_nya_394_elicit_21.wav	mnyamatayo akugwira nkhuku ya raba yokhala ndi mipira isanu ndi itatu kumapazi 
/scratch/skscla001/speech/data/nyagen/audio/221113-173115_nya_626_elicit_11.wav	bambo wina wovala malaya obiriwira komanso chipewa chachikulu cha beige akuyang anira nyumba yogulitsa nyuzipepala yomwe imagulitsa zokhwasula khwasula ndi zakumwa 
/scratch/skscla001/speech/data/nyagen/audio/221113-002910_nya_626_elicit_35.wav	amuna awiri akukambitsirana kutsogolo kwa khoma lolembapo zithunzi ndi anyamata awiri kumbuyo 
/scratch/skscla001/speech/data/nyagen/audio/221101-121530_nya_394_elicit_28.wav	mwamuna wovala shati yoyera yofiira yachikasu ndi yakuda ndi thalauza loyera akupendekekera kumbuyo kuti apewe mwapang ono ng ombe yakuda yomwe ili m bwalo lomenyana ndi ng ombe yokhala ndi utoto wofiira m mbali kwinaku oonerera angapo akuyang ana 
/scratch/skscla001/speech/data/nyagen/audio/221111-192914_nya_394_elicit_26.wav	mzibambo mu yunifomo yofiira afika kucokera pakomo la kampani ngati afuna kuseka komo 
/scratch/skscla001/speech/data/nyagen/audio/221030-015318_nya_394_elicit_45.wav	galu wabulauni akusambira m nyanja ali ndi ndodo m kamwa 
/scratch/skscla001/speech/data/nyagen/audio/221110-233958_nya_626_elicit_48.wav	mayi akukwera njinga yamoto yaying ono yofiira ndi yoyera ndipo wavala chisoti chofananira ndi mpango 
/scratch/skscla001/speech/data/nyagen/audio/221030-101143_nya_394_elicit_6.wav	bambo wina akugona paudzu ndipo waphimbidwa ndi bulangete lapinki 
/scratch/skscla001/speech/data/nyagen/audio/221114-070800_nya_626_elicit_33.wav	ana awiri ndi munthu wamkulu amasilira mwana wakhanda wogwiridwa ndi wamkulu 
/scratch/skscla001/speech/data/nyagen/audio/221111-202609_nya_626_elicit_10.wav	mayi wamkulu wa brunette akuyenda ndi mwana wawo wamwamuna atanyamula chingwe chomangirira chikwama chake chooneka ngati galu 
/scratch/skscla001/speech/data/nyagen/audio/221030-140213_nya_394_elicit_38.wav	pano pali chithunzi cha atsikana two ndi mnyamata mmodzi akuvina mumdima 
/scratch/skscla001/speech/data/nyagen/audio/221028-161302_nya_510_elicit_23.wav	mayi akuthandiza mwana wamng ono kuyatsa kandulo pa keke mu lesitilanti ya disney themed 
/scratch/skscla001/speech/data/nyagen/audio/221029-174228_nya_394_elicit_2.wav	khamu la apaulendo likuyenda pakati pa masitima awiri pasiteshoni yamkati 
/scratch/skscla001/speech/data/nyagen/audio/221002-191144_nya_97d_elicit_13.wav	mnyamata yemwe ali ndi visor akusewera mpira ndi mleme wake mumsewu 
/scratch/skscla001/speech/data/nyagen/audio/221113-005504_nya_626_elicit_34.wav	bambo wina wa ku asia akuphika mbale yomwe ikuyaka m khichini yamalonda 
/scratch/skscla001/speech/data/nyagen/audio/221114-071739_nya_626_elicit_5.wav	mayi wina watsegula maso ake kwambiri ndikutulutsa lilime lake atanyamula kamera kuti ajambule 
/scratch/skscla001/speech/data/nyagen/audio/221109-231342_nya_626_elicit_38.wav	asodzi a pachilumbachi akugwedezeka ndi maukonde awo atagwira ntchito tsiku lonse 
/scratch/skscla001/speech/data/nyagen/audio/221030-103809_nya_394_elicit_2.wav	mtsikana yemwe ali ndi tsitsi lalitali la blond pakati pa malo opanda kanthu ndi mapiri kumbuyo atavala malaya ochokera ku argentina 
/scratch/skscla001/speech/data/nyagen/audio/221112-185920_nya_394_elicit_35.wav	galu amukulu ofiira asewera ndi kagalu kang ono pa udzu 
/scratch/skscla001/speech/data/nyagen/audio/221114-051842_nya_626_elicit_9.wav	mtsikana wamng ono akuchita masewera olimbitsa thupi m mphepete mwa nyanja pamene wina akuyenda mozama m mphepete mwa nyanja 
/scratch/skscla001/speech/data/nyagen/audio/221026-093143_nya_394_elicit_47.wav	mnyamata wovala chipewa chopangidwa ndi mabaluni akumwetulira limodzi ndi abambo ake 
/scratch/skscla001/speech/data/nyagen/audio/221110-233958_nya_626_elicit_13.wav	mwamuna wowoneka waku mexico kapena waku peru akukwera hatchi akumwetulira pansi pa chipewa chake chakumadzulo 
/scratch/skscla001/speech/data/nyagen/audio/221111-180028_nya_394_elicit_34.wav	mtundu uwiri osiyana wa agalu woyera ndi wofiira usowera mupepete mwa nyanja 
/scratch/skscla001/speech/data/nyagen/audio/221030-155230_nya_394_elicit_41.wav	mwamuna wovala jekete yakuda ndi yabuluu komanso chisoti choyera akusefukira m phiri mwachangu 
/scratch/skscla001/speech/data/nyagen/audio/221026-102358_nya_394_elicit_6.wav	mwamuna wa imvi ndi magalasi amayang ana pansi 
/scratch/skscla001/speech/data/nyagen/audio/221111-201023_nya_626_elicit_9.wav	atsikana awiri ovala ngati operekera zakudya akuvina limodzi ndi mwamuna wovala ngati wophika 
/scratch/skscla001/speech/data/nyagen/audio/221113-081436_nya_394_elicit_34.wav	mayi wovala chisoti chanjinga komanso suti yotenthetsera atakhala paki akusinkhasinkha 
/scratch/skscla001/speech/data/nyagen/audio/221028-175312_nya_394_elicit_47.wav	achinyamata atatu a gulu loimba mmodzi wa omwe sanawonetse nkhope yake wina akuimba gitala ya bass ndi wina yemwe akumwetulira 
/scratch/skscla001/speech/data/nyagen/audio/221114-083438_nya_626_elicit_16.wav	amuna awiri m modzi woyera wakuda atakhala kuseri kwa desiki lolandirira alendo m nyumba yomwe ili ndi zowerengera za granite ndi makoma okhomedwa ndi matabwa 
/scratch/skscla001/speech/data/nyagen/audio/221030-142923_nya_394_elicit_14.wav	bambo wina wovala malaya ofiira akugona panjinga m dera la anthu aku asia 
/scratch/skscla001/speech/data/nyagen/audio/221111-234816_nya_626_elicit_45.wav	mnyamata wamng ono wovala malaya abuluu ndi chisoti chofiira atakwera njinga m mphepete mwa msewu 
/scratch/skscla001/speech/data/nyagen/audio/221028-175312_nya_394_elicit_44.wav	kamnyamata kovala magalasi ndi t shirt yolembedwa kuti ndine pepper ndi dr 
/scratch/skscla001/speech/data/nyagen/audio/221023-130745_nya_394_elicit_39.wav	msilikali wachimuna atatopa zankhondo zobiriwira akuyang ana chida chakale chachitsulo choyikidwa pabedi la udzu 
/scratch/skscla001/speech/data/nyagen/audio/221111-180028_nya_394_elicit_3.wav	anthu pamakonde awiri ndi mzibambo alukwera mupaipi pafupi ndi konde lamutsi akutilidwa madzi 
/scratch/skscla001/speech/data/nyagen/audio/221101-122816_nya_394_elicit_17.wav	galu woyera wokhala ndi mpira wa tenisi mkamwa mwake akudutsa udzu wobiriwira 
/scratch/skscla001/speech/data/nyagen/audio/221114-071739_nya_626_elicit_3.wav	munthuyo ali pamtengo womwe uli pakati pa madzi 
/scratch/skscla001/speech/data/nyagen/audio/221030-152551_nya_394_elicit_38.wav	anyamata achichepere ovala ma jezi obiriwira ndi abuluu amakankha mozungulira mpira pamene masewera ena a mpira amachitikira kumbuyo 
/scratch/skscla001/speech/data/nyagen/audio/221114-072554_nya_626_elicit_18.wav	gulu lina lovala malaya ofananirako likuimba nyimbo ndi khoma la njerwa kumbuyo kwawo 
/scratch/skscla001/speech/data/nyagen/audio/221028-171512_nya_394_elicit_12.wav	ndi kunyada kwakukulu kavaloyo akukwera pamwamba pa nkhokwe yaing ono pamene wokwerayo akugwira 
/scratch/skscla001/speech/data/nyagen/audio/221111-001809_nya_626_elicit_5.wav	mwamuna yemwe ali kutsogolo akuthamanga mpikisano wothamanga pamene ena amatsatira kumbuyo ndipo gulu likuyang ana 
/scratch/skscla001/speech/data/nyagen/audio/221111-202609_nya_626_elicit_28.wav	gulu la ophunzira akuyeserera nyimbo ina 
/scratch/skscla001/speech/data/nyagen/audio/221028-164751_nya_394_elicit_42.wav	banja lovina likuchita dip pomwe mwamunayo wagwada pansi 
/scratch/skscla001/speech/data/nyagen/audio/221002-191144_nya_97d_elicit_22.wav	wogwira ntchito atavala suti yalalanje akugwada pansi akuyang ana makina 
/scratch/skscla001/speech/data/nyagen/audio/221028-151132_nya_394_elicit_8.wav	mwamuna wa tsitsi lakuda ndi masharubu akuda atakhala pansi n kuyika dzanja lake pamwamba pa nyala zoyaka atanyamula mbale yachitsulo 
/scratch/skscla001/speech/data/nyagen/audio/221113-090125_nya_394_elicit_16.wav	anthu atatu m modzi wovala jekete lofiira m modzi wovala jekete yobiriwira ndipo m modzi wa jekete yakuda ali ndi zipewa za jekete pamutu pawo ndipo atayima m mphepete mwa thanthwe 
/scratch/skscla001/speech/data/nyagen/audio/221029-190025_nya_394_elicit_37.wav	mzimayi akumwetulira akuonetsa mnyamata wamng ono mtengo wa accordion ndikumulola kuti agwire chidacho 
/scratch/skscla001/speech/data/nyagen/audio/221113-093450_nya_394_elicit_32.wav	bambo wina atavala zovala zodzionetsera akukwera pa atv ya mawilo anayi akukokera mtsikana wina yemwe wavala malaya abuluu ndi chipewa chofiyira pa chipale chofewa 
/scratch/skscla001/speech/data/nyagen/audio/221029-125840_nya_394_elicit_20.wav	mbalame ziwiri zokalamba zachikondi zikuvina m misewu ndi kumveka kwa gulu loimba 
/scratch/skscla001/speech/data/nyagen/audio/221030-115956_nya_394_elicit_41.wav	mnyamata wina wovala malaya obiriwira akukwera pa skateboard m paki pomwe anyamata atatu akuwonera 
/scratch/skscla001/speech/data/nyagen/audio/221002-202925_nya_97d_elicit_9.wav	munthu wovala sweti yofiira akuyang ana zithunzi zapakhoma 
/scratch/skscla001/speech/data/nyagen/audio/221114-053225_nya_626_elicit_27.wav	mwana wovala magalasi oteteza amawombera kamfuti kakang ono 
/scratch/skscla001/speech/data/nyagen/audio/221113-081436_nya_394_elicit_24.wav	chithunzi chojambulidwa usiku chamsewu ndi bambo akuyang ana mumsewu 
/scratch/skscla001/speech/data/nyagen/audio/221111-201023_nya_626_elicit_6.wav	amuna atatu atakhala mkati mwa sitolo pamene nyali zobiriwira za neon zimawaunikira kunja 
/scratch/skscla001/speech/data/nyagen/audio/221109-230703_nya_626_elicit_4.wav	bambo wina wovala t shirt yoyera ndi chisoti atakhala panjinga akutembenuka kuti alowe m chikwama chake 
/scratch/skscla001/speech/data/nyagen/audio/221114-071739_nya_626_elicit_8.wav	anthu atatu ovala ma parachuti akugwera limodzi mlengalenga 
/scratch/skscla001/speech/data/nyagen/audio/221113-001849_nya_626_elicit_18.wav	ana awiri atayima kutsogolo kwa mpanda wamatabwa wotseguka onse atavala mathalauza apinki ndi malaya aatali manja pamene mtsikana wina akugwedeza 
/scratch/skscla001/speech/data/nyagen/audio/221114-063718_nya_626_elicit_47.wav	gulu la achinyamata omwe ali ndi x m manja mwawo akumwetulira 
/scratch/skscla001/speech/data/nyagen/audio/221023-203406_nya_510_elicit_40.wav	bambo wina wovala malaya alalanje waima pafupi ndi katsamba ka mphika m kati mwa nyumba 
/scratch/skscla001/speech/data/nyagen/audio/221002-191144_nya_97d_elicit_15.wav	mnyamata wokhazikika bwino amaima ndi phazi limodzi pafupi ndi gombe loyera la nyanja 
/scratch/skscla001/speech/data/nyagen/audio/221113-005504_nya_626_elicit_14.wav	bambo wina waima kutsogolo kwa sitolo ya njerwa atavala jekete yakuda 
/scratch/skscla001/speech/data/nyagen/audio/221030-015318_nya_394_elicit_41.wav	galu akuyesa kukhota pafupi ndi benchi yapafupi ndi chitsulo 
/scratch/skscla001/speech/data/nyagen/audio/221113-005504_nya_626_elicit_18.wav	mnyamata watsitsi lakuda wovala t sheti yoyera kabudula wakuda wokhala ndi mikwingwirima yofiira ndi yabuluu pambali pake akuthamanga motsatira mpanda wawaya 
/scratch/skscla001/speech/data/nyagen/audio/221110-230544_nya_626_elicit_9.wav	mayi wa tsitsi lofiirira atakhala ndi kamtsikana kakang ono kakang ono kakang ono kakang ono kakang ono kamene kali ndi tsitsi lalifupi la bulauni pafupi ndi maluwa ofiira 
/scratch/skscla001/speech/data/nyagen/audio/221111-202609_nya_626_elicit_43.wav	mnyamata wovala t sheti yotuwa waima pafupi ndi mtsikana wovala chovala chobiriwira ndi chipewa cha cowboy pamphepete mwa nyanja 
/scratch/skscla001/speech/data/nyagen/audio/221113-100223_nya_394_elicit_12.wav	galu wamkulu wabulauni akuthamangitsa kagalu kakang ono koyera mu udzu 
/scratch/skscla001/speech/data/nyagen/audio/221110-233958_nya_626_elicit_42.wav	bambo akuthamanga kudutsa msewu kutsogolo kwa nyumba yomwe ikumangidwa 
/scratch/skscla001/speech/data/nyagen/audio/221028-172637_nya_510_elicit_6.wav	wovala chovala chakuda chakuda akugwera m madzi kuchokera pa bolodi 
/scratch/skscla001/speech/data/nyagen/audio/221111-181340_nya_394_elicit_39.wav	munyamata ndi mitengo ikuluikulu yosambila ayenda ndi manja yake yonuolola pa hombe 
/scratch/skscla001/speech/data/nyagen/audio/221030-163139_nya_394_elicit_17.wav	mwamuna wosavala malaya akuvina yekha maso otsinzina 
/scratch/skscla001/speech/data/nyagen/audio/221114-090743_nya_626_elicit_16.wav	mwamuna ndi mkazi wokongola atavala malaya akugwa aima pamodzi munthambi za mtengo 
/scratch/skscla001/speech/data/nyagen/audio/221113-152024_nya_626_elicit_17.wav	anthu awiri avala zipewa zowala zowala pamene akugwira ntchito m mbali mwa nyumba ina atakwezedwa pazida zomangira zabuluu 
/scratch/skscla001/speech/data/nyagen/audio/221111-183608_nya_394_elicit_1.wav	mzibambo wa cicepele mujuzi ya buluu akoza nsomba pomwe atatu azibambo ena alupenyerera mzibambo wina aliyese mwaiyo ndi fodya kapena machesi pakamwa pake 
/scratch/skscla001/speech/data/nyagen/audio/221114-085825_nya_626_elicit_5.wav	mwamuna ndi mkazi wake atavala majekete a buluu ndi mnyamata wina ataima pafupi ndi mtsinjewo 
/scratch/skscla001/speech/data/nyagen/audio/221112-185920_nya_394_elicit_20.wav	azibambo anai aseweza pakuika mitengo pansi awiri ayanga kwina pomwe awiri afosholera mitengo pansi 
/scratch/skscla001/speech/data/nyagen/audio/221113-173115_nya_626_elicit_26.wav	mnyamatayo wavala magalasi a buluu ndipo akudumpha ndi njanji yachikasu 
/scratch/skscla001/speech/data/nyagen/audio/221112-185920_nya_394_elicit_21.wav	mzibambo wamalaya ofiira ndi magalasi wa weramila pansi pafupi ndi kagalu kang ono kali mabulangete yamaonekedwe ambiri za nyama 
/scratch/skscla001/speech/data/nyagen/audio/221110-224814_nya_626_elicit_15.wav	anthu awiri atakhala pamtengo pafupi ndi mtengo akucheza 
/scratch/skscla001/speech/data/nyagen/audio/221026-102358_nya_394_elicit_29.wav	ana awiri akuda mmodzi atavala chipangizo choyandama akusewera padziwe 
/scratch/skscla001/speech/data/nyagen/audio/221101-124651_nya_394_elicit_19.wav	wina akusema chipilala chamatabwa pogwiritsa ntchito mpeni dzanja lawo lamanzere ndi phazi lakumanja nthawi zambiri mumawona mapazi opanda kanthu 
/scratch/skscla001/speech/data/nyagen/audio/221030-151347_nya_394_elicit_20.wav	amuna awiri ovala majekete aima pafupi ndi tebulo lomwe lili ndi mabotolo anayi omveka bwino 
/scratch/skscla001/speech/data/nyagen/audio/221023-130745_nya_394_elicit_43.wav	galimoto yoopsa kwambiri imadumpha magalimoto osweka ndi kulowa mumlengalenga mkati mwabwalo 
/scratch/skscla001/speech/data/nyagen/audio/221101-144049_nya_394_elicit_42.wav	mayi wina atavala nsonga yakuda ndi yofiira thalauza lakuda ndi magalasi adzuwa ali ndi mbale yotayika pafupi ndi mkazi wina atavala nsonga yakuda ndi magalasi adzuwa ndi mwamuna wovala malaya ofiira onse atayima kuseri kwa tebulo lokhala ndi zakudya zosiyanasiyana 
