audio	sentence	gender_domain
/scratch/skscla001/experiments/datasets/nyagen/audio/221112-183906_nya_394_elicit_8.wav	mzibambo mu malaya oyera alakula ndindi azibambo awiri ndi mzimai awirisoomwe akhala pa benchi 	1
/scratch/skscla001/experiments/datasets/nyagen/audio/221028-134716_nya_394_elicit_8.wav	munthuyo wavala zazifupi ndikukwera phiri la mchenga wotuwa pansi pa thambo labuluu 	1
/scratch/skscla001/experiments/datasets/nyagen/audio/221030-142923_nya_394_elicit_25.wav	mnyamata wina atakwera m nyumba akuima kutsogolo kwa maikolofoni atanyamula gitala 	1
/scratch/skscla001/experiments/datasets/nyagen/audio/221111-183608_nya_394_elicit_32.wav	gulu la anthu kumi ndi umodzi muzobvala za nthawi ya chisanu ngati ma benizi ma jakete otuma magalavisi ndi zikwama zopapa aimirira mu chisanu pochoka mopalasa mu nyumba yopangidwa ndi mabuloko achisanu pomwe munth ali patsogolo pa komo akuwasogolera 	1
/scratch/skscla001/experiments/datasets/nyagen/audio/221101-141218_nya_394_elicit_23.wav	kuyandikira kwa kalulu woyera ndi kavalo wina woyera ndi kavalo wakuda kumbuyo 	1
/scratch/skscla001/experiments/datasets/nyagen/audio/221101-103229_nya_394_elicit_44.wav	bambo wina wovala malaya obiriwira akugwira ntchito pansi pa galimoto yabuluu 	1
/scratch/skscla001/experiments/datasets/nyagen/audio/221029-175401_nya_394_elicit_14.wav	munthu wakuda wovala thunthu labuluu wokutidwa ndi sopo akusamba m kasupe wamadzi pafupi ndi masitepe 	1
/scratch/skscla001/experiments/datasets/nyagen/audio/221101-181423_nya_394_elicit_30.wav	amuna ndi akazi asonkhana pa sitolo yodzaza ndi zinthu zovala zopachikidwa pazitsulo zimabalalika ponseponse 	1
/scratch/skscla001/experiments/datasets/nyagen/audio/221101-181423_nya_394_elicit_34.wav	mzere wa mipando yomwe imawoneka ngati anthu oyendetsedwa ndi ma taxi yomwe inkayenda m mphepete mwa mpanda ina yodzaza ndi anthu 	1
/scratch/skscla001/experiments/datasets/nyagen/audio/221021-231334_nya_394_elicit_13.wav	konsati yodzaza ndi masiku ano imasangalatsa anthu ndi mamembala pafupifupi khumi ali pa siteji ndipo omvera amawomba m manja ndipo mkazi wina ali ndi mpango wabuluu wobiriwira wophimba mutu wake 	1
/scratch/skscla001/experiments/datasets/nyagen/audio/221030-125341_nya_394_elicit_45.wav	bambo wina wovala suti akuyenda mumsewu atanyamula chikwama cha pepala chabulauni 	1
/scratch/skscla001/experiments/datasets/nyagen/audio/221101-142343_nya_394_elicit_41.wav	kamtsikana kakang ono ka jeans wabuluu ndi apuloni yamitundu yosiyanasiyana ali mkati mwake akuyang ana duwa 	1
/scratch/skscla001/experiments/datasets/nyagen/audio/221028-151132_nya_394_elicit_10.wav	atavala jekete labulauni mpango wamitundumitundu ndi kachikwama mkazi wachikulire amayenda m mbali mwa msewu akuyang ana pansi pafupi ndi mtengo wobiriwira wokulungidwa ndi pulasitiki 	1
/scratch/skscla001/experiments/datasets/nyagen/audio/221030-142923_nya_394_elicit_29.wav	wapolisi wayima pakati pa zinjoka pa chikondwerero cha chaka chatsopano cha china 	1
/scratch/skscla001/experiments/datasets/nyagen/audio/221030-151347_nya_394_elicit_40.wav	mtsikana akukwera mwala m nyengo yozizira pamene mwamuna wachikulire akumugwetsera pamwamba pake 	1
/scratch/skscla001/experiments/datasets/nyagen/audio/221111-183608_nya_394_elicit_22.wav	munthu wina wa pa ulalo wautali ndipo kuli maonekedwe amakumbi abuluu 	1
/scratch/skscla001/experiments/datasets/nyagen/audio/221030-171304_nya_394_elicit_8.wav	mtsikana wina wovala malaya obiriwira komanso akabudula atakwera njinga yake kudutsa nyumba yabwino kwambiri 	1
/scratch/skscla001/experiments/datasets/nyagen/audio/221030-103809_nya_394_elicit_1.wav	anyamata awiri ovala malaya abuluu ndi magalasi akujambula kamera 	1
/scratch/skscla001/experiments/datasets/nyagen/audio/221113-094807_nya_394_elicit_25.wav	mayi wa mtundu wa brunette wovala zamaluwa zamitundumitundu komanso mkanda wa ngale akulankhula atanyamula galasi la vinyo 	1
/scratch/skscla001/experiments/datasets/nyagen/audio/221030-154054_nya_394_elicit_41.wav	mayi wina wovala malaya ofiira chipewa ndi mpango amakhala m mphepete mwa msewu atazunguliridwa ndi matumba a zinthu zosiyanasiyana ena m matumba ndipo ena ali m machubu apulasitiki abuluu ofiira kapena akuda 	1
/scratch/skscla001/experiments/datasets/nyagen/audio/221029-184356_nya_394_elicit_1.wav	anthu asanu akudumpha manja awo molunjika kutsogolo kwa nyanja 	1
/scratch/skscla001/experiments/datasets/nyagen/audio/221101-125835_nya_394_elicit_4.wav	mayi wina atavala jekete akuyang ana foni yake yam manja kwinaku akuyang ana mwana 	1
/scratch/skscla001/experiments/datasets/nyagen/audio/221101-181423_nya_394_elicit_22.wav	gulu la oimba achimuna linapangana mu semicircle pa siteji atanyamula zikwatu pamene anthu ena akuwajambula 	1
/scratch/skscla001/experiments/datasets/nyagen/audio/221030-173405_nya_394_elicit_34.wav	galu wabulauni akuyang ana galu woyera akutafuna chingwe cha buluu 	1
/scratch/skscla001/experiments/datasets/nyagen/audio/221030-133842_nya_394_elicit_5.wav	njonda yachikulire mu kanjira yopapatiza ndi chithunzi pakhoma 	1
/scratch/skscla001/experiments/datasets/nyagen/audio/221030-114647_nya_394_elicit_10.wav	mayi wina wovala jinzi akudutsa mayi wina atavala zovala zofiira m bwalo 	1
/scratch/skscla001/experiments/datasets/nyagen/audio/221030-131635_nya_394_elicit_39.wav	anthu awiri onse ovala ma jinzi ayimirira m mphepete mwa madzi ndi ndodo zophera nsomba 	1
/scratch/skscla001/experiments/datasets/nyagen/audio/221030-154054_nya_394_elicit_33.wav	mwamuna ndi galu atakhala pa benchi ya m paki ndipo anthu angapo akuyenda m njira imene imadutsa m mbali mwake 	1
/scratch/skscla001/experiments/datasets/nyagen/audio/221029-163752_nya_394_elicit_40.wav	awiri a cosplayers mmodzi wakuda wakuda wina wofiira amadziyesa kumenyana 	1
/scratch/skscla001/experiments/datasets/nyagen/audio/221028-152630_nya_394_elicit_49.wav	ana awiri ovala ma jekete akuyenda mumsewu wafumbi atanyamula maluwa 	1
/scratch/skscla001/experiments/datasets/nyagen/audio/221030-124227_nya_394_elicit_36.wav	munthu wovala zida zonse zokwera pamahatchi amawerama pafupi ndi theka lakumbuyo la kavalo wabulauni 	1
/scratch/skscla001/experiments/datasets/nyagen/audio/221101-125835_nya_394_elicit_43.wav	mwamuna wovala suti yakuda ndi tayi akuwerenga buku akudikirira m sitima yapansi panthaka 	1
/scratch/skscla001/experiments/datasets/nyagen/audio/221029-181608_nya_394_elicit_49.wav	womanga yemwe ali ndi chipewa cholimba atagwira thabwa ndikuyenda pamwamba pa nyumba yomwe akumangayo atamangirira unyolo wachitetezo 	1
/scratch/skscla001/experiments/datasets/nyagen/audio/221030-121119_nya_394_elicit_23.wav	mwamuna waimirira pamwamba pa makwerero natambasulira dzanja lake lamanja kwa mwamuna wina amene wagwira chingwe cha pawindo la nyumba yachitatu yosanja 	1
/scratch/skscla001/experiments/datasets/nyagen/audio/221111-181340_nya_394_elicit_43.wav	munyamata mu malaya apinki ayendetsa njinga yamoto pa michanga youjika kenaka awiri ayendetsa pa mseu 	1
/scratch/skscla001/experiments/datasets/nyagen/audio/221030-114647_nya_394_elicit_39.wav	mayi wakuda akuyang anira kamwana kakang ono koyera m dzenje lodzaza ndi mipira yapulasitiki 	1
/scratch/skscla001/experiments/datasets/nyagen/audio/221030-171304_nya_394_elicit_37.wav	munthu wovala chisoti wakwera njinga yakuda panjira yafumbi m nkhalango 	1
/scratch/skscla001/experiments/datasets/nyagen/audio/221026-113140_nya_394_elicit_23.wav	pali ma snowboarders awiri mmodzi yemwe wavala zoyera akuchita chinyengo 	1
/scratch/skscla001/experiments/datasets/nyagen/audio/221028-135800_nya_394_elicit_14.wav	munthu wina anajambula mayiyu asanadye nsomba yake 	1
/scratch/skscla001/experiments/datasets/nyagen/audio/221030-130510_nya_394_elicit_0.wav	dj yemwe ali ndi dzanja limodzi pamakutu ake ndi dzanja limodzi patebulo lake 	1
/scratch/skscla001/experiments/datasets/nyagen/audio/221029-180426_nya_394_elicit_15.wav	bambo wina wovala kapu yosambira komanso kusambira akudumphira m dziwe pamene amuna ena akungoyang ana 	1
/scratch/skscla001/experiments/datasets/nyagen/audio/221113-094807_nya_394_elicit_10.wav	mayi wachikulire wanyamula khanda lalikulu ndi nthiwatiwa kuti limuteteze kuti asadzikandale 	1
/scratch/skscla001/experiments/datasets/nyagen/audio/221028-152630_nya_394_elicit_36.wav	mwamuna wadazi atavala suti yakuda akudumphadumpha m mwamba pabwalo losambira atagwira chogwiririra chotsetsereka m madzi 	1
/scratch/skscla001/experiments/datasets/nyagen/audio/221029-154453_nya_394_elicit_43.wav	mwana wamng ono akuyamwa chala chake chachikulu akugona ndi bulangete lapinki pampando wamitundumitundu 	1
/scratch/skscla001/experiments/datasets/nyagen/audio/221101-183550_nya_394_elicit_27.wav	mwamuna wa tsitsi lalitali lakuda atavala shati yakuda ndi taye yamitundu yambiri akugwiritsa ntchito bolodi lamagetsi lokhala ndi magetsi 	1
/scratch/skscla001/experiments/datasets/nyagen/audio/221029-182929_nya_394_elicit_15.wav	msungwana wamng ono atavala nyengo yozizira mu kapu ndi sweti lalitali la manja pafupi kukwera makwerero a chipika kumalo ochitira masewera 	1
/scratch/skscla001/experiments/datasets/nyagen/audio/221026-113140_nya_394_elicit_2.wav	kamwana kakang ono ka blond akusewera ndi zidutswa zamitundu yosiyanasiyana pa mwendo wa munthu wina 	1
/scratch/skscla001/experiments/datasets/nyagen/audio/221101-174201_nya_394_elicit_38.wav	amuna asanu ovala jeans amasewera gulu pa siteji yokhala ndi maonekedwe amtundu wonyezimira 	1
/scratch/skscla001/experiments/datasets/nyagen/audio/221101-174201_nya_394_elicit_16.wav	amuna atatu akhala pamiyala mumchenga pamene mwamuna wovala chipewa chofiira ndi malaya akuyang ana kunja 	1
/scratch/skscla001/experiments/datasets/nyagen/audio/221028-134716_nya_394_elicit_41.wav	mayi wina wovala malaya abuluu wanyamula kamtsikana ka zovala zofiira kunja kwa hema 	1
/scratch/skscla001/experiments/datasets/nyagen/audio/221113-075005_nya_394_elicit_5.wav	azimayi atatu ovala malaya mashalu oderapo komanso masiketi aatali abulauni aima panjira ya njerwa ndi galu wokhala pansi 	1
/scratch/skscla001/experiments/datasets/nyagen/audio/221030-172350_nya_394_elicit_30.wav	mwamuna wovala chipewa chachikasu ali ndi chikho chasiliva 	1
/scratch/skscla001/experiments/datasets/nyagen/audio/221030-155230_nya_394_elicit_25.wav	gulu la anthu oyenda m mapaketi akukwera pamakwerero amiyala m nkhalango 	1
/scratch/skscla001/experiments/datasets/nyagen/audio/221030-121119_nya_394_elicit_8.wav	pali munthu wina pakati pa msewu akudumpha m mwamba ndi dzanja lake pafupi ndi mapiri 	1
/scratch/skscla001/experiments/datasets/nyagen/audio/221112-183906_nya_394_elicit_5.wav	mwana ndi mbambo akhala pansi onse diokonzeka asewezetsa mabulasho ndi mabaketi autoto 	1
/scratch/skscla001/experiments/datasets/nyagen/audio/221113-072748_nya_394_elicit_25.wav	banja lina panja mvula ikugwa pa mpikisano wamagalimoto omwe akuthamanga nawo 	1
/scratch/skscla001/experiments/datasets/nyagen/audio/221026-093143_nya_394_elicit_44.wav	bambo wina wovala malaya ofiira akuchita chinyengo ndi skateboard yake 	1
/scratch/skscla001/experiments/datasets/nyagen/audio/221028-134716_nya_394_elicit_30.wav	mwana akuyang ana manja ake a sopo pamene akusamba 	1
/scratch/skscla001/experiments/datasets/nyagen/audio/221029-175401_nya_394_elicit_2.wav	mayi wina wazaka zapakati akunyamula msungwana m manja pamene akugona m kanyumba kanyumba 	1
/scratch/skscla001/experiments/datasets/nyagen/audio/221026-111146_nya_394_elicit_16.wav	munthu wakwera njovu pamene wina akugwira mutu wa njovu 	1
/scratch/skscla001/experiments/datasets/nyagen/audio/221029-174228_nya_394_elicit_33.wav	mayi wina akugwira magazini akugwira kunja kwa zenera lamatabwa 	1
/scratch/skscla001/experiments/datasets/nyagen/audio/221101-152830_nya_394_elicit_39.wav	mayi wina wovala suti yabizinesi akukhala pa desiki ndikulemba pa kiyibodi yake 	1
/scratch/skscla001/experiments/datasets/nyagen/audio/221030-131635_nya_394_elicit_28.wav	bambo wina amene wavala suti yolembedwa dzina waima kutsogolo kwa maikolofoni akuwerenga n kumaona zimene tikunena 	1
/scratch/skscla001/experiments/datasets/nyagen/audio/221029-182929_nya_394_elicit_18.wav	amuna asanu ovala zovala zodziwika bwino za ku asia amavala zovala pamutu pamene anthu akucheza chammbuyo 	1
/scratch/skscla001/experiments/datasets/nyagen/audio/221113-093450_nya_394_elicit_9.wav	gulu la amuna ozungulira khumi ovala malaya ndi mataye akufika mmwamba ndikumwetulira 	1
/scratch/skscla001/experiments/datasets/nyagen/audio/221111-182436_nya_394_elicit_23.wav	munthu ndi kabudula ofiira wakhala mu malo ampana pomwe moto uluka 	1
/scratch/skscla001/experiments/datasets/nyagen/audio/221026-111146_nya_394_elicit_19.wav	munthu wa magalasi adzuwa akabudula a buluu ndi malaya oyera akumenya mpira wa tenisi 	1
/scratch/skscla001/experiments/datasets/nyagen/audio/221101-145402_nya_394_elicit_3.wav	gulu la amuna limayimba zida zoimbira panja 	1
/scratch/skscla001/experiments/datasets/nyagen/audio/221101-152830_nya_394_elicit_3.wav	mwamuna wina wovala malaya amizeremizere ndi magalasi akudumphira m mwamba pafupi ndi mwamuna wina wovala chovala chakuda chosonyeza kudumpha m mwamba ndi manja ake atatambasula kutsogolo kwa nyumba ina 	1
/scratch/skscla001/experiments/datasets/nyagen/audio/221030-150324_nya_394_elicit_1.wav	ana anayi azaka zapakati pa sekondale amakhala mozungulira tebulo kudya chakudya ndi kukambirana 	1
/scratch/skscla001/experiments/datasets/nyagen/audio/221030-132751_nya_394_elicit_20.wav	gulu losiyanasiyana la anthu owoneka achichepere likuwoneka kuti likudikirira kuti maphunziro ayambe 	1
/scratch/skscla001/experiments/datasets/nyagen/audio/221030-135047_nya_394_elicit_28.wav	bambo wachikulire wokhala ndi ndevu zazitali ndi tsitsi ndi kadontho kofiira kumutu kwake kokhala ndi zizindikiro zoyera 	1
/scratch/skscla001/experiments/datasets/nyagen/audio/221026-135935_nya_394_elicit_8.wav	mwana mu malaya ofiira ndi thalauza amaika chidebe cha pulasitiki chobiriwira ndi mazira a isitala pamutu pake 	1
/scratch/skscla001/experiments/datasets/nyagen/audio/221101-122816_nya_394_elicit_7.wav	galu woyera atanyamula floppy wapinki frisbee mkamwa akudumpha ndi mapazi onse anayi kuchokera pansi 	1
/scratch/skscla001/experiments/datasets/nyagen/audio/221101-112237_nya_394_elicit_37.wav	mwamuna wina wovala malaya ofiira ndi jinzi ya buluu waima kutsogolo kwa khoma ndi mithunzi ya anthu ena kutsogolo kwake panjira 	1
/scratch/skscla001/experiments/datasets/nyagen/audio/221101-121530_nya_394_elicit_34.wav	munthu wamkulu akudyetsa kamtsikana kakang ono chojambula chokulungidwa ndi burrito 	1
/scratch/skscla001/experiments/datasets/nyagen/audio/221113-091210_nya_394_elicit_19.wav	anthu anayi akuthamanga mosiyanasiyana paphiri la chipale chofewa pamene galu akuthamangitsa mmodzi wa iwo mwamasewera 	1
/scratch/skscla001/experiments/datasets/nyagen/audio/221113-080157_nya_394_elicit_20.wav	pamphepete mwa nyanja pali anthu ambiri kuphatikizapo ana 	1
/scratch/skscla001/experiments/datasets/nyagen/audio/221113-094807_nya_394_elicit_17.wav	wovala skateboarder wovala jeans ndi malaya oyera amachita chinyengo 	1
/scratch/skscla001/experiments/datasets/nyagen/audio/221101-174201_nya_394_elicit_23.wav	kamnyamata kakutidwa ndi bulangete loyera akugona pampando 	1
/scratch/skscla001/experiments/datasets/nyagen/audio/221113-081436_nya_394_elicit_4.wav	amuna awiri ovala zipewa aima m njira pafupi ndi nyumba ya njerwa 	1
/scratch/skscla001/experiments/datasets/nyagen/audio/221113-092355_nya_394_elicit_43.wav	mwana wamng ono wovala juzi labulauni akuthamanga m njira pafupi ndi udzu 	1
/scratch/skscla001/experiments/datasets/nyagen/audio/221030-101143_nya_394_elicit_44.wav	mnyamata wovala mathalauza amtundu wa buluu akudumphira m madzi 	1
/scratch/skscla001/experiments/datasets/nyagen/audio/221030-114647_nya_394_elicit_16.wav	bambo wina akugwa chagada atavala zosambira pamadzi ambiri pafupi ndi mzinda wina 	1
/scratch/skscla001/experiments/datasets/nyagen/audio/221030-145157_nya_394_elicit_2.wav	achinyamata awiri akuthandiza amayi awo kunyamula mng ono wawo mayi wawo atalandira foni 	1
/scratch/skscla001/experiments/datasets/nyagen/audio/221111-183608_nya_394_elicit_34.wav	mzibambo kutsogolo wabvala malaya oyera ndi kabudula wakuda achobva njinga ndi swanda mseu otanganidwa 	1
/scratch/skscla001/experiments/datasets/nyagen/audio/221030-131635_nya_394_elicit_24.wav	khamu la anthu limayenda m bwalo lalikulu usiku ndi utsi kapena chifunga chikuyenda pamwamba pawo 	1
/scratch/skscla001/experiments/datasets/nyagen/audio/221030-144005_nya_394_elicit_49.wav	bambo wina wa ku asia wokhala ndi ma headphone akunyodola pamene akugwira ntchito yokhotakhota m chipinda chamdima 	1
/scratch/skscla001/experiments/datasets/nyagen/audio/221030-105310_nya_394_elicit_34.wav	anyamata awiri akhala kutsogolo kwa nyumba akudya ma popsicle 	1
/scratch/skscla001/experiments/datasets/nyagen/audio/221101-145402_nya_394_elicit_28.wav	munthu wovala chovala chachikulu cha pinki chooneka ngati makona atatu akugwedeza mafunde ngati mwamuna ndi mkazi atavala zofanana zamizeremizere yowala komanso zowoneka ngati madontho akumwetuliranso 	1
/scratch/skscla001/experiments/datasets/nyagen/audio/221026-115610_nya_394_elicit_9.wav	mnyamata wosavala malaya wovala mathalauza a kakhi wagwada m dambo pamene wina akumwaza chapafupi 	1
/scratch/skscla001/experiments/datasets/nyagen/audio/221026-093143_nya_394_elicit_42.wav	mayi wavala chipewa choyera komanso mkazi wake caftan wanyamula zinthu zokongola kuti agulitse 	1
/scratch/skscla001/experiments/datasets/nyagen/audio/221022-142238_nya_394_elicit_4.wav	munthu akudumphira m thamanda m thamanda pamene ena atatu akuyang ana 	1
/scratch/skscla001/experiments/datasets/nyagen/audio/221026-113140_nya_394_elicit_17.wav	galu woyera ndi wabulauni amaima pa khoma lamwala usiku pamene chipale chofewa chikugwa 	1
/scratch/skscla001/experiments/datasets/nyagen/audio/221029-160417_nya_394_elicit_14.wav	mwamuna wovala malaya otuwa ndi jinzi waima pafupi ndi malo owala adzuwa lowala m phanga kapena mumgodi wamtundu wina 	1
/scratch/skscla001/experiments/datasets/nyagen/audio/221101-141218_nya_394_elicit_29.wav	atsikana anayi ndi anyamata awiri akudumpha m mwamba kutsogolo kwa zitseko zagalasi ku nyumba 	1
/scratch/skscla001/experiments/datasets/nyagen/audio/221101-112237_nya_394_elicit_41.wav	galimoto yothamanga ya buluu ndi yoyera ili ndi malawi otuluka kuchokera m chitoliro chake 	1
/scratch/skscla001/experiments/datasets/nyagen/audio/221111-182436_nya_394_elicit_46.wav	ana ambiri asewera masewera agalimoto polaris pabwalo 	1
/scratch/skscla001/experiments/datasets/nyagen/audio/221023-174803_nya_394_elicit_26.wav	mnyamata panjinga akukwera ndi mng ono wake pampando wamwana womwe ukungoyenda pang onopang ono 	1
/scratch/skscla001/experiments/datasets/nyagen/audio/221028-145922_nya_394_elicit_16.wav	mayi wina wa ku asia atavala malaya apinki komanso chipewa chonyamula mbali ya mpanda 	1
/scratch/skscla001/experiments/datasets/nyagen/audio/221113-093450_nya_394_elicit_22.wav	wotsetsereka wa slalom atavala mathalauza ofiira ndi malaya akuda akutsetsereka kudutsa mbendera yofiira 	1
/scratch/skscla001/experiments/datasets/nyagen/audio/221030-105310_nya_394_elicit_30.wav	mkwatibwi wovala chovala choyera wanyamula maluwa ofiirira ataima pafupi ndi mkwati wake 	1
/scratch/skscla001/experiments/datasets/nyagen/audio/221101-174201_nya_394_elicit_12.wav	bambo wina wovala chipewa chofiyira atanyamula mwala waukulu atakhala pa mulu wa miyala ikuluikulu pafupi ndi madzi 	1
/scratch/skscla001/experiments/datasets/nyagen/audio/221022-135414_nya_394_elicit_10.wav	wovala wa gaily akupereka chinthu chaching ono chosadziwika kwa mayi wodabwitsa kwambiri 	1
/scratch/skscla001/experiments/datasets/nyagen/audio/221030-164539_nya_394_elicit_5.wav	amuna awiri akuyankhula ndi kuyang ana zipatso zomwe zikugulitsidwa pamsika wa zipatso pamene mkazi wina akuyang ananso malonda 	1
/scratch/skscla001/experiments/datasets/nyagen/audio/221101-121530_nya_394_elicit_14.wav	mayi wina wa ku spain akugwira ntchito yokonza masamba obiriwira osiyanasiyana pamsika 	1
/scratch/skscla001/experiments/datasets/nyagen/audio/221030-145157_nya_394_elicit_43.wav	mayi wina wa ku asia waimirira pa kauntala ndipo wanyamula ndalama m manja mwake 	1
/scratch/skscla001/experiments/datasets/nyagen/audio/221026-135935_nya_394_elicit_38.wav	ana ang onoang ono awiri atakhala m chipinda chapulasitiki chokhala ndi buluu 	1
/scratch/skscla001/experiments/datasets/nyagen/audio/221030-144005_nya_394_elicit_42.wav	osambira ampikisano amadumpha kuchokera m mphepete mwa dziwe kupita kumadzi 	1
/scratch/skscla001/experiments/datasets/nyagen/audio/221101-113540_nya_394_elicit_11.wav	kamnyamata kakumwa madzi a m kasupe pamene kamnyamata kena kakumayang ana n kupanga nkhope 	1
/scratch/skscla001/experiments/datasets/nyagen/audio/221101-112237_nya_394_elicit_10.wav	banja lina likuyenda mumsewu pamene mwamunayo wanyamula kamwana paphewa limodzi 	1
/scratch/skscla001/experiments/datasets/nyagen/audio/221101-145402_nya_394_elicit_31.wav	bambo yemwe wakhala pansi atavala t sheti yabuluu ndi kapu yobiriwira akutsamira pa galasi logawanitsa m galimoto ya sitima 	1
/scratch/skscla001/experiments/datasets/nyagen/audio/221101-112237_nya_394_elicit_26.wav	mwamuna ndi mnyamata akudya m mphepete mwa mzinda pafupi ndi katoni ndi ngolo yofiira yogulira zinthu 	1
/scratch/skscla001/experiments/datasets/nyagen/audio/221101-144049_nya_394_elicit_42.wav	mayi wina atavala nsonga yakuda ndi yofiira thalauza lakuda ndi magalasi adzuwa ali ndi mbale yotayika pafupi ndi mkazi wina atavala nsonga yakuda ndi magalasi adzuwa ndi mwamuna wovala malaya ofiira onse atayima kuseri kwa tebulo lokhala ndi zakudya zosiyanasiyana 	1
/scratch/skscla001/experiments/datasets/nyagen/audio/221030-095301_nya_394_elicit_28.wav	mayi wina wovala diresi lakuda ndipo wina atavala nsonga yotuwira komanso akabudula wobiriwira akuyenda mumsewu modzaza ndi anthu 	1
/scratch/skscla001/experiments/datasets/nyagen/audio/221113-075005_nya_394_elicit_17.wav	mwamuna waku asia wovala malaya amizere yabuluu mathalauza owala nsapato za raba zakuda akuyendera nsomba yaikulu ya tuna 	1
/scratch/skscla001/experiments/datasets/nyagen/audio/221101-175728_nya_394_elicit_48.wav	bambo wina wovala malaya ofiira akujambulidwa ndi munthu wina pabwalo lamasewera pomwe pali anthu ambiri akumaonerera ndi kusangalala 	1
/scratch/skscla001/experiments/datasets/nyagen/audio/221023-170816_nya_394_elicit_17.wav	pali sitolo yotseguka ya abarrotes mexico ndipo bambo waima kutsogolo kwake 	1
/scratch/skscla001/experiments/datasets/nyagen/audio/221030-161731_nya_394_elicit_35.wav	bambo akunyamula mpira wobiriwira pamtengo kwa khamu la anthu pamsewu 	1
/scratch/skscla001/experiments/datasets/nyagen/audio/221029-175401_nya_394_elicit_39.wav	ma llamas awiri achikulire atakhala pomwe mwana wina llama akusisita kholo lake ndipo wina amasisita mwini wake 	1
/scratch/skscla001/experiments/datasets/nyagen/audio/221113-075005_nya_394_elicit_30.wav	mayi waima kutsogolo kwa sitolo atapingasa manja 	1
/scratch/skscla001/experiments/datasets/nyagen/audio/221028-145922_nya_394_elicit_48.wav	wamng ono wokwera njinga uyu watulutsa manja ake pamene akuyesera njira iyi 	1
/scratch/skscla001/experiments/datasets/nyagen/audio/221026-152356_nya_394_elicit_4.wav	bambo wovala malaya akuda akuwonetsa mawu akuti miyala yolembetsa akusewera kiyibodi 	1
/scratch/skscla001/experiments/datasets/nyagen/audio/221028-131629_nya_394_elicit_49.wav	mayi wovala chovala chakuda ndi choyera atagwira magalasi ake 	1
/scratch/skscla001/experiments/datasets/nyagen/audio/221111-190309_nya_394_elicit_34.wav	mnyamata omwetulira asambira pansi pa madzi paziwe 	1
/scratch/skscla001/experiments/datasets/nyagen/audio/221030-123234_nya_394_elicit_17.wav	munthu wovala kabudula wofiirira akukwera njinga kukwera phiri 	1
/scratch/skscla001/experiments/datasets/nyagen/audio/221113-100223_nya_394_elicit_27.wav	mtsikana wina watsitsi la blondi akuseweretsa nthambi za mtengo pafupi ndi tsamba lomwe lili ndi masamba 	1
/scratch/skscla001/experiments/datasets/nyagen/audio/221029-180426_nya_394_elicit_2.wav	pali anthu ambiri amene amaonerera gulu la anthu akuimba violin pa siteji 	1
/scratch/skscla001/experiments/datasets/nyagen/audio/221101-124651_nya_394_elicit_3.wav	anthu awiri otsetsereka otsetsereka ovala zipewa zawo atakwera mumsewu 	1
/scratch/skscla001/experiments/datasets/nyagen/audio/221021-234718_nya_394_elicit_29.wav	galu wamkulu waubweya akuyenda m madzi ali ndi ndodo yaikulu m kamwa mwake 	1
/scratch/skscla001/experiments/datasets/nyagen/audio/221113-084828_nya_394_elicit_4.wav	nyani wina akudumphira pafupi ndi nyani wina pamwamba pa matabwa 	1
/scratch/skscla001/experiments/datasets/nyagen/audio/221113-092355_nya_394_elicit_1.wav	anthu amenewa akusambira akutulutsa manja ndi miyendo m madzi 	1
/scratch/skscla001/experiments/datasets/nyagen/audio/221030-121119_nya_394_elicit_30.wav	anthu ambiri m nkhalango ndi mwamuna ataima pa chipika atavala malaya oyera 	1
/scratch/skscla001/experiments/datasets/nyagen/audio/221113-082401_nya_394_elicit_43.wav	mnyamata akuchita chinyengo ndi skateboard yake pakhoma 	1
/scratch/skscla001/experiments/datasets/nyagen/audio/221030-132751_nya_394_elicit_31.wav	kagulu kakang ono ka anthu kaimilira m bwalo lamiyala lozingidwa ndi zida za msasa ndi tizigawo ta chipale chofewa 	1
/scratch/skscla001/experiments/datasets/nyagen/audio/221030-172350_nya_394_elicit_22.wav	munthu wovala zoyera akuthawa amuna awiri omwe akumuthamangitsa atavala zakuda 	1
/scratch/skscla001/experiments/datasets/nyagen/audio/221101-131437_nya_394_elicit_8.wav	msilikali akuyenda ndi akazi awiri ndi mwamuna wina wachikulire mumsewu umene uli ndi masamba agwa 	1
/scratch/skscla001/experiments/datasets/nyagen/audio/221030-124227_nya_394_elicit_25.wav	azimayi awiri ovala zovala za denim akukhala pansi akucheza ndipo mtsikana wina yemwe ali ndi pulasitiki yachikasu amakhala pambali 	1
