audio	sentence	gender_domain
/scratch/skscla001/experiments/datasets/nyagen/audio/221026-152356_nya_394_elicit_13.wav	galu wabulauni ndi woyera wokhala ndi kolala yakuda ndi tagi yagolide akunyambita chipale chofewa kuchokera kumphuno 	1
/scratch/skscla001/experiments/datasets/nyagen/audio/221026-104953_nya_394_elicit_16.wav	wothamanga yekhayekha atavala chikwama chofiira akupunthwa m phiri lachisanu 	1
/scratch/skscla001/experiments/datasets/nyagen/audio/221021-231334_nya_394_elicit_18.wav	mayi wina ndi kamnyamata aimirira pansi pa mtengo waukulu ndipo mayiyo akuukoka ndi chingwe 	1
/scratch/skscla001/experiments/datasets/nyagen/audio/221101-183550_nya_394_elicit_24.wav	amuna awiri amayendetsa galimoto yonyamula simenti masana atavala ma t shirt oyera ndi ma jean a buluu ndipo m modzi wa iwo akulankhula pa foni yam manja 	1
/scratch/skscla001/experiments/datasets/nyagen/audio/221030-154054_nya_394_elicit_36.wav	mwamuna wovala t shirt ya buluu ndi jinzi ya buluu atayima kutsogolo kwa dziwe lomwe lili ndi kakombo pafupi ndi phiri 	1
/scratch/skscla001/experiments/datasets/nyagen/audio/221029-184356_nya_394_elicit_28.wav	kamwana kakang ono kachikazi kayimirira kutsogolo kwa makina ochezera a pa tv 	1
/scratch/skscla001/experiments/datasets/nyagen/audio/221028-131629_nya_394_elicit_27.wav	pa masewera a karati mwamuna amayesa kumenya mnzake kumaso 	1
/scratch/skscla001/experiments/datasets/nyagen/audio/221028-152630_nya_394_elicit_38.wav	mnyamata wovala malaya achikasu akuyang ana pamadzi ndi anthu ena angapo 	1
/scratch/skscla001/experiments/datasets/nyagen/audio/221028-175312_nya_394_elicit_46.wav	mwamuna wina wovala suti ya buluu akuyenda kutsogolo kwa oimba a kwaya ovala zobiriwira 	1
/scratch/skscla001/experiments/datasets/nyagen/audio/221028-145922_nya_394_elicit_39.wav	bambo wina wovala malaya akuda ndi zotsekera m makutu akuyang ana injini ya galimoto yothamanga yofiira ndi yoyera pamene mwamuna wina wovala magalasi akuyang ana 	1
/scratch/skscla001/experiments/datasets/nyagen/audio/221029-161925_nya_394_elicit_11.wav	woyenda yekhayekha wokhala ndi chikwama chofiyira amayenda panjira yamiyala 	1
/scratch/skscla001/experiments/datasets/nyagen/audio/221030-142923_nya_394_elicit_40.wav	mayi wina yemwe wavala tsitsi labulauni ndi magalasi waima pafupi ndi hema wakuda ndi woyera 	1
/scratch/skscla001/experiments/datasets/nyagen/audio/221030-133842_nya_394_elicit_23.wav	kamtsikana kakang ono kovala malaya achikasu ndi ndolo akudya chakudya cham mbale yobiriwira ndi supuni 	1
/scratch/skscla001/experiments/datasets/nyagen/audio/221030-133842_nya_394_elicit_27.wav	bambo wina anaika chitini chake chofiira cha petulo ndi jenereta kuti alankhule ndi bambo amene ananyamula penti yaikulu 	1
/scratch/skscla001/experiments/datasets/nyagen/audio/221029-154453_nya_394_elicit_29.wav	mayi wina watsitsi la blond wavala magalasi adzuwa ndi mahedifoni akunyamula ndudu 	1
/scratch/skscla001/experiments/datasets/nyagen/audio/221028-151132_nya_394_elicit_33.wav	mwamuna wovala zopakapaka wanyamula gitala ndi harmonica waima kutsogolo kwa maikolofoni 	1
/scratch/skscla001/experiments/datasets/nyagen/audio/221030-151347_nya_394_elicit_15.wav	mayi yemwe wavala chipewa cha munthu wantchito yofiyira komanso jekete yofiyira akuyenda m mapiri omwe ali pamwamba pa chipale chofewa 	1
/scratch/skscla001/experiments/datasets/nyagen/audio/221113-083437_nya_394_elicit_7.wav	antchito awiri ogwira ntchito yomanga amagwiritsa ntchito chipangizo chachikulu 	1
/scratch/skscla001/experiments/datasets/nyagen/audio/221022-142238_nya_394_elicit_30.wav	mayi wina watsitsi lalitali labulauni wavala jekete labulauni ndi jeans yabuluu 	1
/scratch/skscla001/experiments/datasets/nyagen/audio/221030-173405_nya_394_elicit_18.wav	mayi wina wovala chovala chachifupi chakuda ndi nsapato zakuda akuvina mozungulira ndi miyuni yamoto 	1
/scratch/skscla001/experiments/datasets/nyagen/audio/221101-112237_nya_394_elicit_18.wav	wokwera njinga pamwamba pa phiri losazama amayesa chinyengo pafupi ndi khomo ndi malo a udzu 	1
/scratch/skscla001/experiments/datasets/nyagen/audio/221101-183550_nya_394_elicit_13.wav	amuna awiri akutsanulira konkriti pagalimoto ina 	1
/scratch/skscla001/experiments/datasets/nyagen/audio/221113-075005_nya_394_elicit_18.wav	mwamuna wina atanyamula tochi akuyang ana zinthu zofanana ndi mzera wina pamene wina akulemba manotsi 	1
/scratch/skscla001/experiments/datasets/nyagen/audio/221030-130510_nya_394_elicit_22.wav	bambo wokongoletsedwa kwambiri amatsogolera akazi anayi ovala zokongola kwambiri omwe amavala zovala zokongola mumasewera owoneka ngati achipembedzo ku thailand 	1
/scratch/skscla001/experiments/datasets/nyagen/audio/221028-144622_nya_394_elicit_5.wav	gulu laling ono lopangidwa ndi anyamata achichepere four ali pakati pakuchita 	1
/scratch/skscla001/experiments/datasets/nyagen/audio/221030-135047_nya_394_elicit_31.wav	mtsikana akusewera ndi kasupe wa sprinkler amalumphira pamalo achikasu konkire 	1
/scratch/skscla001/experiments/datasets/nyagen/audio/221111-194707_nya_394_elicit_45.wav	mzimai ndi malaya apinki ndi jizi labuluu ayenda mseu wina wotanganidwa pomwe aligwirilile kapu was kofi 	1
/scratch/skscla001/experiments/datasets/nyagen/audio/221028-145922_nya_394_elicit_8.wav	mayi wina atavala cardigan yonyezimira ndi mpango wonyezimira komanso magalasi adzuwa kumutu kwake 	1
/scratch/skscla001/experiments/datasets/nyagen/audio/221030-115956_nya_394_elicit_20.wav	galu wakuda ndi wabulauni ali pansi 	1
/scratch/skscla001/experiments/datasets/nyagen/audio/221030-172350_nya_394_elicit_21.wav	mnyamatayo akugwira nkhuku ya raba yokhala ndi mipira isanu ndi itatu kumapazi 	1
/scratch/skscla001/experiments/datasets/nyagen/audio/221112-185920_nya_394_elicit_49.wav	mzibambo mzimai ndi ka mtsikana avala zovala zamwabo waukwati aimilira kubali nyanja pa gombe 	1
/scratch/skscla001/experiments/datasets/nyagen/audio/221028-162153_nya_394_elicit_28.wav	mayi wina akudumphira pa benchi ya m paki uku akuponya masamba m mwamba 	1
/scratch/skscla001/experiments/datasets/nyagen/audio/221030-133842_nya_394_elicit_46.wav	mtsikana wina wovala malaya ofiira ndi ma jinzi akuyima pamwamba pa nyumba yoimika magalimoto 	1
/scratch/skscla001/experiments/datasets/nyagen/audio/221030-125341_nya_394_elicit_25.wav	munthu ameneyu ali ndi chipewa choyera cholimba ndi vest la imvi ndi malaya aatali manja ataima pamwamba pa denga 	1
/scratch/skscla001/experiments/datasets/nyagen/audio/221030-160514_nya_394_elicit_37.wav	mwana wakhanda atavala chovala chachikasu akuyasamula ndi pakamwa pake 	1
/scratch/skscla001/experiments/datasets/nyagen/audio/221101-112237_nya_394_elicit_38.wav	munthu wodzilemba mphini wovala zakuda ndi chipewa chalalanje akuimba ndikuyimba gitala 	1
/scratch/skscla001/experiments/datasets/nyagen/audio/221113-082401_nya_394_elicit_20.wav	wina akupanga chinyengo panjinga yofiira pamaso pa anthu ambiri 	1
/scratch/skscla001/experiments/datasets/nyagen/audio/221111-180028_nya_394_elicit_47.wav	azibambo awiri akhala patenje wa nyumba pomwe wina ali pamanela 	1
/scratch/skscla001/experiments/datasets/nyagen/audio/221030-131635_nya_394_elicit_26.wav	mayi wovala jekete yakuda wayima kutsogolo kwa chithunzi cha kanema hors du temps 	1
/scratch/skscla001/experiments/datasets/nyagen/audio/221030-171304_nya_394_elicit_29.wav	azimayi anayi ndi mkwatibwi aima mumsewu ndipo mmodzi wa iwo akuloza chinachake chapatali 	1
/scratch/skscla001/experiments/datasets/nyagen/audio/221030-171304_nya_394_elicit_4.wav	bambo wina ali m mlengalenga atagwira msana wake wa munthu wina wowerama 	1
/scratch/skscla001/experiments/datasets/nyagen/audio/221101-174201_nya_394_elicit_41.wav	mnyamata akukwera pabwalo losambira pamwamba pa kafunde kakang ono m madzi abuluu owala 	1
/scratch/skscla001/experiments/datasets/nyagen/audio/221030-171304_nya_394_elicit_39.wav	mwana wovala chovala chamitundu yowoneka bwino akudutsa pamng alu wa mpanda 	1
/scratch/skscla001/experiments/datasets/nyagen/audio/221026-115610_nya_394_elicit_47.wav	mtsikana wina watsitsi loderapo atavala juzi labulauni ndi mkanda wagolide wanyamula mbale ziwiri zoyera 	1
/scratch/skscla001/experiments/datasets/nyagen/audio/221030-131635_nya_394_elicit_48.wav	munthu wonenepa wovala t shirt yakuda ndi tsitsi lakuda ndi imvi akutsuka mano ake ndi mswachi wamagetsi m chipinda chokhala ndi kalendala pakhoma ndi nyali pa chovala 	1
/scratch/skscla001/experiments/datasets/nyagen/audio/221023-174803_nya_394_elicit_12.wav	mnyamata ndi mtsikana atavala makhoti zipewa ndi nsapato ali kugombe akuyang ana chinachake chimene anapeza 	1
/scratch/skscla001/experiments/datasets/nyagen/audio/221029-190025_nya_394_elicit_9.wav	mwana wamng ono wovala malaya obiriwira ndi chipewa chamtundu wa asodzi pafupi ndi madzi akusewera ndi mpira wabuluu ndi woyera 	1
/scratch/skscla001/experiments/datasets/nyagen/audio/221030-114647_nya_394_elicit_9.wav	wosewera mpira wa rugby yemwe wavala top of colored wapeza try pomwe osewera amtundu wakuda akuthamangira kwa iye 	1
/scratch/skscla001/experiments/datasets/nyagen/audio/221101-113540_nya_394_elicit_36.wav	bambo wamkulu wakuda wavala malaya ofiira a chicago atakhala panjinga ya olumala pafupi ndi mtengo wanyali wabuluu 	1
/scratch/skscla001/experiments/datasets/nyagen/audio/221113-075005_nya_394_elicit_16.wav	bambo wina wovala chidebe cha penti yofiyira akulemba manambala zigawo za nsomba 	1
/scratch/skscla001/experiments/datasets/nyagen/audio/221029-165214_nya_394_elicit_27.wav	mwamuna wovala malaya amizeremizere yoyera patebulo lotchova njuga ali pafupi ndi mkazi wovala pamwamba pakuda akugwedeza paketi yamakhadi ofiira 	1
/scratch/skscla001/experiments/datasets/nyagen/audio/221101-131437_nya_394_elicit_45.wav	anthu awiri anyamula chikwama cha zinyalala kukonzekera kunyamula zinyalala pomwe munthu wachitatu akuyang ana chikwama cha kamera 	1
/scratch/skscla001/experiments/datasets/nyagen/audio/221030-164539_nya_394_elicit_4.wav	bambo wina wa kum mawa wokhala ndi magalasi ndi vesiti yokongola akuyenda mumsewu ndi mtsikana watsitsi la blond 	1
/scratch/skscla001/experiments/datasets/nyagen/audio/221030-172350_nya_394_elicit_0.wav	kamtsikana kakang ono kofiirira kamakhala pansi kakuyang ana mulu wa mabuku 	1
/scratch/skscla001/experiments/datasets/nyagen/audio/221030-101143_nya_394_elicit_25.wav	ana atatu ali mubafa akupopera madzi a mu shawa 	1
/scratch/skscla001/experiments/datasets/nyagen/audio/221030-114647_nya_394_elicit_14.wav	mtsikanayu wakhala pampando wozungulira kudikirira kuti masewera a carnival ayambe 	1
/scratch/skscla001/experiments/datasets/nyagen/audio/221111-180028_nya_394_elicit_1.wav	mphunzi wacikadzi wacicepele waponya kwendo lake kumenya ndi kutyola bolodi yogwindwa ndi mphunzitsi wake wa karati 	1
/scratch/skscla001/experiments/datasets/nyagen/audio/221023-174803_nya_394_elicit_13.wav	anthu awiri ovala mayunifolomu a mpira wa buluu ofiira ndi oyera anagwadira ngati akusewera 	1
/scratch/skscla001/experiments/datasets/nyagen/audio/221029-170522_nya_394_elicit_14.wav	galu wakuda anadumpha kuchokera m madzi pafupi ndi gombe la nkhalango 	1
/scratch/skscla001/experiments/datasets/nyagen/audio/221111-180028_nya_394_elicit_33.wav	mzibambo akumba chisanu cokosa pa dziwe 	1
/scratch/skscla001/experiments/datasets/nyagen/audio/221029-170522_nya_394_elicit_9.wav	munthu waima padoko pafupi ndi maboti angapo pamene amuna ena awiri ali m ngalawa imodzi 	1
/scratch/skscla001/experiments/datasets/nyagen/audio/221028-131629_nya_394_elicit_19.wav	kamnyamata kakang ono kakukwera pa chidole cham bwalo lamasewera kwinaku akuloza pa slide 	1
/scratch/skscla001/experiments/datasets/nyagen/audio/221101-114800_nya_394_elicit_31.wav	wokwera njinga atavala buluu ndi wachikasu akuyenda kudutsa mitengo 	1
/scratch/skscla001/experiments/datasets/nyagen/audio/221022-142238_nya_394_elicit_9.wav	gulu la anthu oyendetsa ngalawa m mudzi wina wosonkhanitsa nyama kuti adye phwando lalikulu lomwe lidzachitike pakati pa mapiri obiriwira okongolawa m mphepete mwa nyanjayi 	1
/scratch/skscla001/experiments/datasets/nyagen/audio/221111-194707_nya_394_elicit_23.wav	mzibambo mu jizi nd jakete la citetezo aseweza pansi pajerwa 	1
/scratch/skscla001/experiments/datasets/nyagen/audio/221026-115610_nya_394_elicit_13.wav	amuna awiri akumana ndi kasupe yemwe adamezedwa ndi magetsi atavala malaya a winter 	1
/scratch/skscla001/experiments/datasets/nyagen/audio/221101-144049_nya_394_elicit_39.wav	ana atatu akusewera m mphepete mwa nyanja ndipo bwato litaima kumbuyo kwake 	1
/scratch/skscla001/experiments/datasets/nyagen/audio/221030-125341_nya_394_elicit_48.wav	mnyamata wachichepele atakhala pansi akuyang ana mayi akuyang ana kwa mwamuna wovala jekete yofiira ndi thalauza lakuda atatsamira pamtengo 	1
/scratch/skscla001/experiments/datasets/nyagen/audio/221113-091210_nya_394_elicit_42.wav	galu wakuda woyera ndi bulauni akudzuka mu chipale chofewa ali ndi chidole chofiira pakamwa pake pafupi ndi mtengo wa ayezi 	1
/scratch/skscla001/experiments/datasets/nyagen/audio/221029-190025_nya_394_elicit_15.wav	mayi wovala apuloni wobiriwira ndi manja opindika akugwira pansi pa imodzi pamzere wa nyama zaubweya 	1
/scratch/skscla001/experiments/datasets/nyagen/audio/221113-100223_nya_394_elicit_3.wav	galu waubweya akuthamanga pabwalo la udzu 	1
/scratch/skscla001/experiments/datasets/nyagen/audio/221113-072748_nya_394_elicit_0.wav	bambo wina wovala malaya ofiira akabudula abulauni ndi ma nikes ofiira ndi oyera akudumpha m mwamba kuti akamenye mpira wa tennis pabwalo 	1
/scratch/skscla001/experiments/datasets/nyagen/audio/221029-163752_nya_394_elicit_37.wav	gulu la ochemerera ovala zovala zabuluu zokhala ndi tutus zoyera akudumphira pamodzi mogwirizana ndi manja awo ali mmwamba 	1
/scratch/skscla001/experiments/datasets/nyagen/audio/221030-144005_nya_394_elicit_18.wav	anyamata anayi ovala mayunifolomu ofiirira ndi otuwa akulankhula ndi mwamuna wina pachitseko chagalaja chomwe chili panyumba ya njerwa zofiira 	1
/scratch/skscla001/experiments/datasets/nyagen/audio/221101-112237_nya_394_elicit_33.wav	mwamuna wovala malaya ofiira ndi magolovesi akuntchito akusalaza miyala pansi pa nyumbayo 	1
/scratch/skscla001/experiments/datasets/nyagen/audio/221030-144005_nya_394_elicit_13.wav	galu wabulauni ndi wakuda akuyesera kugwira mpira wofiira mkamwa mwake 	1
/scratch/skscla001/experiments/datasets/nyagen/audio/221028-171512_nya_394_elicit_43.wav	gulu la ovina munjanji yapansi panthaka akuvina kuti apeze ndalama 	1
/scratch/skscla001/experiments/datasets/nyagen/audio/221028-131629_nya_394_elicit_22.wav	mwamuna ndi mkazi akudutsa galimoto yomwe ili ndi chizindikiro chokongola kutsogolo 	1
/scratch/skscla001/experiments/datasets/nyagen/audio/221030-165931_nya_394_elicit_35.wav	dzenje lalikulu la konkriti likukumbidwa ndi makina akuluakulu okumba 	1
/scratch/skscla001/experiments/datasets/nyagen/audio/221111-180028_nya_394_elicit_9.wav	mzibambo wamalaya ofiira ya manja atali woyendetsa mtutu pa bilidgi ilipa nyanja 	1
/scratch/skscla001/experiments/datasets/nyagen/audio/221113-092355_nya_394_elicit_23.wav	galu wakuda mu chipale chofewa amadumpha chinthu chofiira m mphepete mwa chimango 	1
/scratch/skscla001/experiments/datasets/nyagen/audio/221028-153920_nya_394_elicit_22.wav	zikuoneka kuti anthu asanu amene ali kunjawa akusodza 	1
/scratch/skscla001/experiments/datasets/nyagen/audio/221028-134716_nya_394_elicit_24.wav	bambo wina wovala chipewa chakuda suti yakuda ndi plaid yakuda komanso malaya alalanje akusewera kumbuyo kwa munthu yemwe wavala malaya akuda otsegula wagwira kapepala ndikuyimba maikolofoni 	1
/scratch/skscla001/experiments/datasets/nyagen/audio/221030-141802_nya_394_elicit_1.wav	amuna awiri ovala zipewa zolimba zoyera akugwira ntchito pa chinthu chachikulu mkati mwa mpanda womangidwa ndi tcheni 	1
/scratch/skscla001/experiments/datasets/nyagen/audio/221029-181608_nya_394_elicit_15.wav	mwamuna wavala chipewa chotuwa wanyamula chida cham manja pamwamba pa chitsulo cha dzimbiri 	1
/scratch/skscla001/experiments/datasets/nyagen/audio/221026-111146_nya_394_elicit_37.wav	galu woyera amayenda m kanjira kamene kali ndi chipale chofewa chopyapyala 	1
/scratch/skscla001/experiments/datasets/nyagen/audio/221113-080157_nya_394_elicit_43.wav	woyenda pa mafunde atavala suti yakuda akugwira mafunde pomwe wina akuyesera kuti amugwire 	1
/scratch/skscla001/experiments/datasets/nyagen/audio/221028-181315_nya_394_elicit_23.wav	mnyamata yemwe wavala ma skate okhala ndi chipewa choyera ali panjanji yachikasu 	1
/scratch/skscla001/experiments/datasets/nyagen/audio/221030-173405_nya_394_elicit_21.wav	wokwera njinga yamoto panjira ya miyala ndi munthu yemwe ali ndi kamera kumbuyo komwe kuli mitengo mozungulira 	1
/scratch/skscla001/experiments/datasets/nyagen/audio/221030-123234_nya_394_elicit_19.wav	pali anthu ambiri amene akhala kapena kuimirira pamchenga ndipo pali thirakitala 	1
/scratch/skscla001/experiments/datasets/nyagen/audio/221113-080157_nya_394_elicit_5.wav	mwamuna wina yemwe ali ndi tattoo yamtundu wamtundu akumwetulira pa kamera atanyamula khanda lovala buluu ndi loyera pamapewa ake 	1
/scratch/skscla001/experiments/datasets/nyagen/audio/221030-151347_nya_394_elicit_31.wav	mnyamata m modzi wovala chovala choyera komanso t sheti yofiira atagwira phazi lake lakumanzere akuyeserera masewera a skateboard usiku 	1
/scratch/skscla001/experiments/datasets/nyagen/audio/221030-133842_nya_394_elicit_16.wav	pa mpikisano mwana amatambasula dzanja lake kwa othamanga omwe akuthamanga mosiyana ndi iye 	1
/scratch/skscla001/experiments/datasets/nyagen/audio/221030-095301_nya_394_elicit_6.wav	mayi wina atavala zovala zamitundumitundu akuyenda mumsewu atanyamula kachikwama kakuda kwinaku akulankhula pa foni yake 	1
/scratch/skscla001/experiments/datasets/nyagen/audio/221028-171512_nya_394_elicit_4.wav	gulu la amuna ovala mathalauza obisala ndi ma t shirt oyera akuthamanga pabwalo loboola 	1
/scratch/skscla001/experiments/datasets/nyagen/audio/221111-190309_nya_394_elicit_37.wav	mtsikana mu deresi la jizi lazolemba madothi ayenda copanda nsapato pa tabwa loika bwino 	1
/scratch/skscla001/experiments/datasets/nyagen/audio/221028-164751_nya_394_elicit_25.wav	mayi wina wakhala pampando m mphepete mwa nyanja kumbuyo kwa nyanja 	1
/scratch/skscla001/experiments/datasets/nyagen/audio/221112-185920_nya_394_elicit_11.wav	mzimai wa cimwenye ndi mzimai wa ciafirikani america akuika bwino mbale zawo zaphikira 	1
/scratch/skscla001/experiments/datasets/nyagen/audio/221113-090125_nya_394_elicit_35.wav	munthuyo wavala zoyera kuyambira kumutu mpaka kumapazi ndipo akuyenda mumsewu 	1
/scratch/skscla001/experiments/datasets/nyagen/audio/221111-183608_nya_394_elicit_25.wav	mzibambo aphika comwe cioneka ngati binzi ya gilini mutswanda loochera pa cisulo coochera ndi labu wacikhausu imilirapomwe munthu wina akujambulila ma pikicha pa mwamba 	1
/scratch/skscla001/experiments/datasets/nyagen/audio/221021-224449_nya_394_elicit_2.wav	mwamuna wovala t shirt yakuda akusakaniza chinachake pamodzi ndi manja ake m chidebe choyera 	1
/scratch/skscla001/experiments/datasets/nyagen/audio/221028-164751_nya_394_elicit_23.wav	mnyamata wina wovala malaya akuda akufuna kugwira mavwende pamodzi ndi anyamata ena awiri 	1
/scratch/skscla001/experiments/datasets/nyagen/audio/221030-132751_nya_394_elicit_0.wav	mwana wovala malaya ofiira akusewera m mabala pamene mnyamata wina akuyang ana 	1
/scratch/skscla001/experiments/datasets/nyagen/audio/221030-173405_nya_394_elicit_43.wav	kamnyamata kakang ono kakumwetulira ndikunyowa akuthamanga m madzi osaya atavala malaya abuluu ndi kabudula wakuda wopangidwa ndi mapangidwe 	1
/scratch/skscla001/experiments/datasets/nyagen/audio/221113-090125_nya_394_elicit_23.wav	pano pali chithunzi cha ogwira ntchito yomanga akukonzekera kupita kukagwira ntchito pamalo okwera 	1
/scratch/skscla001/experiments/datasets/nyagen/audio/221030-173405_nya_394_elicit_15.wav	munthu akukwera m mbali mwa thanthwe lomwe limayang anizana ndi mtsinje 	1
/scratch/skscla001/experiments/datasets/nyagen/audio/221029-125840_nya_394_elicit_24.wav	nyama yaubweya wamtundu wa bulauni imaima pafupi ndi khoma ndi kutsogolo kwa gulu la wachichepere wokhala ndi chipewa chowoneka bwino 	1
/scratch/skscla001/experiments/datasets/nyagen/audio/221026-143340_nya_394_elicit_26.wav	anthu awiri akuyang ana picure atanyamula khadi lolembedwa kuti mukudziwa chiyani ichi 	1
/scratch/skscla001/experiments/datasets/nyagen/audio/221030-152551_nya_394_elicit_46.wav	bambo wina wosavala nsapato atavala kabudula wa utawaleza ndi malaya obiriwira akumaliza kugula chakudya pamalo ogulitsira 	1
/scratch/skscla001/experiments/datasets/nyagen/audio/221022-142238_nya_394_elicit_21.wav	anthu awiri ovala malaya oyera agwira njanji m modzi ali pamwamba pomwe wina wayima 	1
/scratch/skscla001/experiments/datasets/nyagen/audio/221030-015318_nya_394_elicit_17.wav	amuna ovala malaya ofiira ndi mathalauza akuda akulankhula ndi mtsikana yemwe ali ndi foda yabuluu 	1
/scratch/skscla001/experiments/datasets/nyagen/audio/221028-134716_nya_394_elicit_6.wav	bambo wina wovala buluu ndi zoyera akuimitsidwa m mwamba ndi njinga yake yamoto pamene m munsimu muli amuna ena awiri ovala zipewa zoyera ndi zakuda 	1
/scratch/skscla001/experiments/datasets/nyagen/audio/221030-172350_nya_394_elicit_20.wav	kamnyamata kakang ono katakhala pansi kakuyang ana amuna ena ovala ngati cholengedwa chachilendo kapena makina 	1
/scratch/skscla001/experiments/datasets/nyagen/audio/221030-161731_nya_394_elicit_42.wav	bambo wovala magalasi ndi jekete labulauni akumeta chipale chofewa chozama kwambiri m mphepete mwa msewu 	1
/scratch/skscla001/experiments/datasets/nyagen/audio/221113-080157_nya_394_elicit_9.wav	bambo wina wovala ma dreadlocks akuyimba kwambiri ndi maikolofoni pomwe mafani asonkhana mumsewu 	1
/scratch/skscla001/experiments/datasets/nyagen/audio/221113-092355_nya_394_elicit_29.wav	munthu wovala zakuda akutuluka pawindo la nyumba yopyapyala komanso yofiyira 	1
/scratch/skscla001/experiments/datasets/nyagen/audio/221113-083437_nya_394_elicit_31.wav	gulu lalikulu la atsikana ovala zovala zabuluu ndi siliva atayima pa ma bleachers 	1
/scratch/skscla001/experiments/datasets/nyagen/audio/221026-102358_nya_394_elicit_28.wav	atsikana asanu atsitsi loyera komanso labulauni akhala pansi akuwerengera limodzi mabuku 	1
/scratch/skscla001/experiments/datasets/nyagen/audio/221030-155230_nya_394_elicit_21.wav	gulu la anthu linaunjikana mozungulira mapu ndi madiresi okhala ndi zikwama ndi zida zina zakunja 	1
/scratch/skscla001/experiments/datasets/nyagen/audio/221023-174803_nya_394_elicit_28.wav	anyamata awiri akudumphira mutu m madzi ndi mafunde ang onoang ono pamwamba pake 	1
/scratch/skscla001/experiments/datasets/nyagen/audio/221101-122816_nya_394_elicit_6.wav	mtsikana wovala malaya alalanje ndi mnyamata wovala malaya akuda akuyang ana mtsinje 	1
/scratch/skscla001/experiments/datasets/nyagen/audio/221026-143340_nya_394_elicit_7.wav	kamwana kakang ono ka malaya alalanje akufikira dzanja lake mpaka kumaso kwa mwamuna atamugwira ndi mutu wake kumbuyo 	1
/scratch/skscla001/experiments/datasets/nyagen/audio/221113-100223_nya_394_elicit_13.wav	amuna angapo akulankhula pa cholankhulira ndipo munthu wapagalasiyo akuwoneka kuti akunena zinthu zoseketsa 	1
/scratch/skscla001/experiments/datasets/nyagen/audio/221028-181315_nya_394_elicit_8.wav	pakatikati pa tebulo lozungulira lomwe lili ndi mapepala oyala bwino pamakhala phokoso lowala 	1
/scratch/skscla001/experiments/datasets/nyagen/audio/221113-090125_nya_394_elicit_26.wav	osewera awiri a volleyball ya m mphepete mwa nyanja amayenda ndikuyankhulana pamchenga 	1
/scratch/skscla001/experiments/datasets/nyagen/audio/221029-170522_nya_394_elicit_16.wav	bambo wina ali m chipinda chokongoletsera ndi matabwa akuyima ndikuyimba chida chachilendo chozungulira kwinaku akutsagana ndi gulu lamphepo lopangidwa ndi achinyamata omwe akhala kumbuyo kwake 	1
/scratch/skscla001/experiments/datasets/nyagen/audio/221026-102358_nya_394_elicit_42.wav	agalu awiri akuda akuthamanga m chipale chofewa ali ndi chidole chofiira m kamwa mwa galu mmodzi 	1
/scratch/skscla001/experiments/datasets/nyagen/audio/221023-163538_nya_394_elicit_18.wav	anthu asanu oyenda m mapiri amaima mozungulira mulu waukulu wa miyala paphiri kapena paphiri 	1
/scratch/skscla001/experiments/datasets/nyagen/audio/221030-140213_nya_394_elicit_12.wav	atsikana awiri ovala zovala zachisanu akugwedeza munthu wa chipale chofewa ndi mpango 	1
/scratch/skscla001/experiments/datasets/nyagen/audio/221021-231334_nya_394_elicit_24.wav	mwamuna wovala nyimbo zakuda gitala lakuda lamagetsi 	1
/scratch/skscla001/experiments/datasets/nyagen/audio/221030-161731_nya_394_elicit_17.wav	mayi wanyamula ambulera ndi kapu ndi dzanja atanyamula kamnyamata kakang ono ka blonde m chikwama akuthamangira kusukulu 	1
/scratch/skscla001/experiments/datasets/nyagen/audio/221029-175401_nya_394_elicit_9.wav	mzungu wovala chipewa cha mpira ndi chikwama akukwera njinga kwinaku akutembenuza kamera zinthu zonyansa 	1
/scratch/skscla001/experiments/datasets/nyagen/audio/221101-152830_nya_394_elicit_13.wav	azimayi ena akukambirana akugwira ntchito yolima mpunga 	1
/scratch/skscla001/experiments/datasets/nyagen/audio/221113-090125_nya_394_elicit_37.wav	mayi wina wachikulire yemwe wavala diresi yobiriwira wanyamula zikwama zogulira mumsewu wotchingidwa ndi zingwe 	1
/scratch/skscla001/experiments/datasets/nyagen/audio/221028-131629_nya_394_elicit_18.wav	atsikana atatu ovala magalasi akudumphira limodzi mu dziwe losambira 	1
/scratch/skscla001/experiments/datasets/nyagen/audio/221029-174228_nya_394_elicit_9.wav	mwamuna wina wovala malaya amizere yoyera ndi yabuluu wokhala ndi tsitsi lakuda waima m chipinda choyandikana ndi anthu ena akuyang ana kutsogolo 	1
/scratch/skscla001/experiments/datasets/nyagen/audio/221101-154133_nya_394_elicit_43.wav	mwana wovala malaya alalanje akutsanulira legos m thumba lapulasitiki 	1
